"Vertical";"SubTipo";"Marca";"Nombre"
"Hogar";"Salud y medición";"San-Up";"Balanza Digital San Up Medivita Bluetooth App Análisis Corporal Negro"
"Hogar";"Salud y medición";"San-Up";"Termómetro Digital San-up Su-ter403 Transparente Resistente Transparente"
"Hogar";"Salud y medición";"San-Up";"Oxímetro De Dedo San-up Su-oxi801n Negro Led Aaa Negro"
"Hogar";"Salud y medición";"San-Up";"Tensiómetro Digital San-up Su-ted201 Blanco 240 Memorias Blanco"
"Hogar";"Salud y medición";"San-Up";"Tensiómetro Digital De Brazo San Up Batería Medipress Plus Blanco"
"Hogar";"Salud y medición";"San-Up";"Tensiómetro Digital San-up Su-teb401 Blanco Muñeca Blanco"
"Hogar";"Salud y medición";"San-Up";"Nebulizador San-up Su-nep603 Blanco 8ml Con Accesorios Blanco"
"Hogar";"Salud y medición";"San-Up";"Nebulizador A Pistón San-up Airstream 8ml Blanco Con Accesorios"
"Suplementos";"Creatinas";"Ena Sport";"Creatina Monohidrato Ena Sport X 75grs Monodosis 15 Sobres Sin Sabor Sin Gluten"
"Suplementos";"Vitaminas y Salud";"Ena Sport";"Trans Resverastrol Ena Sport X 60 Capsulas Antioxidante Con Vitamina C Y E Sin Sabor"
"Suplementos";"Creatinas";"Ena Sport";"Creatina Monohidrato 150g Ena Sport Sin Sabor 2X1!!!!!"
"Supermercado";"Snacks";"Integra";"Barras Proteica Pasta de Maní Y Arándanos Caja 10u 2x1!!!!"
"Supermercado";"Snacks";"Integra";"Granola Almendras Cajú Y Arándanos Integra 1 Kg 2X1!!!!!"
"Suplementos";"Creatinas";"Full Power";"Creatina Monohidratada Sin Sabor Full Power 300g Sin Sabor"
"Suplementos";"Vitaminas y Salud";"Gold Nutrition";"Nad Nicotinamida Adenina Dinucleótido Gold Nutrition X 30 Caps Energia Sin Sabor"
"Suplementos";"Vitaminas y Salud";"Gold Nutrition";"Glicinato De Magnesio 60 Cápsulas Gold Nutrition Sin Sabor"
"Suplementos";"Creatinas";"Gold Nutrition";"Creatina Monohidrato Gold Nutrition 1kg Neutro Sin Sabor"
"Supermercado";"Cuidado personal";"Sudanta";"Pasta Dental Gel Sudanta Encías Sanas Hinojo Y Menta 50g 3x1!!"
"Supermercado";"Cuidado personal";"Sri Sri Tattva";"Sri Sri Tattva Crema Facial Rejuvenecedora De Noche 100g 3X1!!!"
"Supermercado";"Almacén";"Sri Sri Tattva";"Aceite Ayurvédico Para Bebés 100ml - Coco Y Sésamo - Sri Sri 3x1!!!"
"Supermercado";"Otros alimentos";"Sri Sri Tattva";"Mascarilla Facial Cúrcuma De La India Sri Sri Tattva X 100g 3X1!!!"
"Supermercado";"Cuidado personal";"Sri Sri";"Pasta Dental Sudanta Sri Sri Natural Vegan Libre Fluor 50gr 3X1!!!"
"Suplementos";"Proteinas";"Optimum Nutrition";"Optimum Nutrition Whey Gourmet Proteína 900g Chocolate Malt Chocolate"
"Suplementos";"Proteinas";"Optimum Nutrition";"Whey Gourmet Series 25 Serv Optimum Nutrition Sabor White Chocolate"
"Suplementos";"Proteinas";"Optimum Nutrition";"Whey Protein 100% Gourmet 900g Optimum Nutrition Vainilla"
"Hogar";"Otros hogar";"Kanji";"Proyector Kanji Kj-814 1600lm Blanco"
"Supermercado";"Otros alimentos";"Nonisec";"Apósito Incontinencia Moderada Nonisec X 20 Unidades"
"Supermercado";"Otros alimentos";"Nonisec";"Nonisec Apósitos Para Incontinencia Fuerte X 20 Unidades"
"Suplementos";"Proteinas";"Ena";"Whey Protein 900g Pura 80% Pack Ena Sabor Frutilla 900g Frutilla"
"Suplementos";"Proteinas";"Bsn";"Suplemento En Polvo Bsn Edge Proteínas Sabor Strawberry Milkshake X 1.82kg"
"Suplementos";"Proteinas";"Bsn";"Syntha 6 Edge 4 Lbs Bsn Pura Proteína Aislada Isolate Usa Sabor Vainilla"
"Suplementos";"Proteinas";"Bsn";"Suplemento En Polvo Bsn Edge Proteínas Sabor Chocolate Milkshake 4lb"
"Suplementos";"Proteinas";"Bsn";"Suplemento En Polvo Bsn Edge Proteínas De Syntha-6 Sabor Cookies & Cream X 2.42LB"
"Suplementos";"Proteinas";"Bsn";"Suplemento En Polvo Bsn Edge Proteínas Sabor Cookies & Cream X 4LB"
"Hogar";"Otros hogar";"Kanji";"Lavarropa Kanji Home 6kg Inverter Kjh-wmcfwt Blanco Color Blanco"
"Hogar";"Otros hogar";"Kanji";"Heladera Kanjihome Multi Door 380l Gris No Frost Gris"
"Hogar";"Climatización";"Kanji";"Caloventor Kanji Home Kjh-ch103 2000w Con Termostato Color Naranja Naranja Claro"
"Hogar";"Limpieza y cuidado";"Kanji";"Plancha Kanji 2200w A Vapor Base Ceramica Kjh-pl2403 Verde Claro"
"Hogar";"Limpieza y cuidado";"Kanji";"Plancha Kanji Home Kjhpls1002 1000w Base De Acero Inox Blanco"
"Hogar";"Cocina eléctrica";"Kanji";"Pava Jarra Electrica Kanji Home Kjh-pe15001s De 1.8l 1500w Plateado"
"Hogar";"Cocina eléctrica";"Kanji";"Cafetera Multicapsula Kanjihome Kanji Beige Kjh-cm1500dc01 Beige"
"Hogar";"Cocina eléctrica";"Kanji";"Cafetera Kanji Home Kjh-cm1500nc02 Negra Multicapsula Negro"
"Hogar";"Cocina eléctrica";"Kanji";"Pava Eléctrica Matera Kanji Home Kjh-pe15002m 1500w 1.8 Mate"
"Hogar";"Otros hogar";"Kanji";"Secadora Por Calor Kanjihome 4kg Kjh-drymchwt"
"Hogar";"Cocina eléctrica";"Kanji";"Cafetera Multicapsula Kanjihome Roja Cm1500nc01 19bares Rojo"
"Hogar";"Limpieza y cuidado";"Kanji";"Lavasecarropas Semiautomático Kanji Twin Lava & Seca 5kg Con Bomba De Extracción Xpb55-655sp Blanco"
"Hogar";"Otros hogar";"Kanji";"Freezer De Pozo Tfk-fp50 50 Litros Telefunken Color Blanco"
"Supermercado";"Otros alimentos";"SriSri";"Repelente Natural Mosquitos Insectos Sri Sri Tattva Repelente Natural X150ml 5x1!!!"
"Supermercado";"Otros alimentos";"Dicomere";"Harina De Algarroba Dicomere X200gr Sin Tacc 4X1!!"
"Supermercado";"Almacén";"Dicomere";"Azucar Rubia Organica Dicomere Gmo Free 100% Natural x 1kg Sin Tacc 4X1!!"
"Supermercado";"Otros alimentos";"Dicomere";"Harina De Trigo Integral Orgánica Dicomere 4x1!!"
"Supermercado";"Otros alimentos";"Dicomere";"Harina De Coco Dicomere 200g 4x1!!!"
"Bananero";"El Bananero";"Japi";"Salsa Picante El Bananero Terapia Picante 270ml"
"Bodega";"Bodega";"Fuego Blanco";"Vino Fuego Blanco Valle Del Silex Malbec 750ml"
"Supermercado";"Otros alimentos";"Margarita";"Espumante Margarita Para Los Chanchos Malbec Rose Nat X3 Bot"
"Bodega";"Bodega";"Malcriado";"Vino Malcriado Mosquita Muerta Wines Caja X3 750ml"
"Bodega";"Bodega";"Fuego Blanco";"Vino Fuego Blanco Cabernet Franc-malbec 750 Ml"
"Bodega";"Bodega";"Flintstone";"Vino Fuego Blanco Cabernet Franc Flinstone 750ml"
"Bodega";"Bodega";"Flintstone";"Vino Fuego Blanco Flintstone Malbec 750ml"
"Suplementos";"Vitaminas y Salud";"Leguilab";"Leguilab Bisglicinato De Hierro 60 Cápsulas Neutro Neutro"
"Suplementos";"Vitaminas y Salud";"Leguilab";"Bisglicinato De Cobre Leguilab 60 Caps Neutro Neutro"
"Suplementos";"Vitaminas y Salud";"Labs Nutrition";"Labs Nutrition Moringa Sin Sabor Suplemento Calcio Antioxidante 60 Cápsulas"
"Suplementos";"Vitaminas y Salud";"Labs Nutrition";"Labs Nutrition Testo Up 60 Comp. Sin Sabor Sin Sabor"
"Suplementos";"Vitaminas y Salud";"Labs Nutrition";"Labs Nutrition Superóxido Dismutasa 1000mg 60 Cáps Sin Sabor"
"Suplementos";"Quemadores";"Labs Nutrition";"Labs Nutrition Organic Detox 60 Caps. Sin Sabor"
"Suplementos";"Vitaminas y Salud";"Labs Nutrition";"Suplemento En Cápsulas Labs Nutrition Gluconato De Zinc X 60g Sin Sabor"
"Suplementos";"Vitaminas y Salud";"Labs Nutrition";"Cápsulas Melena León 500mg Labs Nutrition Digestivo 60c Sin Sabor"
"Suplementos";"Vitaminas y Salud";"Labs Nutrition";"Selenio Orgánico Sin Sabor 60 Cápsulas Labs Nutrition"
"Suplementos";"Quemadores";"Labs Nutrition";"Bloqueador De Carbohidratos Labs Nutrition Faseolamina 60c Sin Sabor"
"Suplementos";"Vitaminas y Salud";"Labs Nutrition";"Acido Fólico Labs Nutrition - Vitamina B9 (60 Capsulas) Sin Sabor"
"Suplementos";"Quemadores";"Granger";"Pancake Keto Granger Chocolate 200g"
"Bananero";"El Bananero";"Japi";"Papas Fritas Picantes El Bananero 60g Terapia Picante"
"Hogar";"Climatización";"Ultracomb";"Ultracomb Fr 8619 Freidora De Aire 9l Digital 1800w Negro"
"Bananero";"El Bananero";"Japi";"Salsa Picante ""La Rompe OGT"" x 60ml - Terapia Picante - Edición de El Bananero - Extra Picante"
"Suplementos";"BCAA-Aminos";"Gentech";"Amino 9000 Gentech 160 Comp. Masticables. Bcaa + Esenciales"
"Suplementos";"Proteinas";"Gentech";"Snack Bar Barras De Proteina Vegetal 40 Grs X 10 Un Gentech"
"Suplementos";"Proteinas";"Gentech";"Proteina Gentech Vegana Veggie 500grs 1.1lbs Cacao Cacao"
"Suplementos";"Vitaminas y Salud";"Gentech";"Gentech Zma Magnesio Cápsulas 30g Sin Sabor 30 Unidades Sin Sabor"
"Suplementos";"Proteinas";"Gentech";"Low Carb Protein Bar Gentech 45g Sin Gluten x10"
"Suplementos";"Vitaminas y Salud";"Gentech";"Omega 3 Epa & Dha Gentech 120g 60 Cápsulas Sin Sabor Sin Sabor"
"Suplementos";"Barras y geles";"Gentech";"Barra Proteica Gentech Iron Bar 46g X20u"
"Suplementos";"Proteinas";"Gentech";"Gentech Afa Whey Protein 7900 500g Sachet"
"Suplementos";"Quemadores";"Gentech";"Gentech Tx3 Black Cuts 60 Comp. Adelgazante Sin Sabor Sin Sabor"
"Suplementos";"Ganadores de peso";"Gentech";"Maxi Gain Ganador De Masa 1.25kg Gentech"
"Suplementos";"Ganadores de peso";"Gentech";"Ganador Muscular Maxi Gain Gentech 750g Sin Tacc"
"Suplementos";"Creatinas";"Gentech";"Creatina Monohidratada Gentech 250g Polvo Sin Sabor Sin Sabor"
"Suplementos";"BCAA-Aminos";"Gentech";"Carnitina Gentech L-carnitine En Cápsulas X 90 Cápsulas Sin Sabor"
"Suplementos";"BCAA-Aminos";"Gentech";"Bcaa 4000 Gentech X 120 Tabletas Aminoacidos Sin Sabor"
"Supermercado";"Cuidado personal";"Nonisec";"Pañales Adultos Nonisec Refuerza Super X20 Absorción Máxima"
"Supermercado";"Otros alimentos";"Nonisec";"Nonisec Aposito Incontinencia Extrema X 20 Unidades"
"Supermercado";"Cuidado personal";"Nonisec";"Apósito Refuerza Pañal Clásico Con Gel X20u Nonisec"
"Supermercado";"Otros alimentos";"Nonisec";"Nonisec Ropa Interior Descartable Para Adulto Eg X8 Unidades"
"Supermercado";"Otros alimentos";"Nonisec";"Ropa Interior Descartable Para Adulto Nonisec G X 8 Unidades"
"Supermercado";"Cuidado personal";"Nonisec";"Pañales Adultos Descartables Nonisec Anatómico Ultra Talla Grande 8 Unidades"
"Hogar";"Otros hogar";"Qualika";"Espejo Inteligente Circular Q2 Qualika - Touch + Desempañador + Hora (Luz Cálida / Fría / Amarilla)"
"Hogar";"Otros hogar";"Qualika";"Espejo Inteligente Circular Q1 Qualika - Touch (Luz Cálida / Fría / Amarilla)"
"Hogar";"Otros hogar";"Qualika";"Espejo Inteligente Ovalado Q2 Qualika - Touch + Desempañador + Hora (Luz Cálida / Fría / Amarilla)"
"Hogar";"Otros hogar";"Qualika";"Espejo Inteligente Ovalado Q1 Qualika - Touch (Luz Cálida / Fría / Amarilla)"
"Hogar";"Otros hogar";"Qualika";"Espejo Inteligente Cuadrado Q2 Qualika - Touch + Desempañador + Hora (Luz Cálida / Fría / Amarilla)"
"Hogar";"Otros hogar";"Qualika";"Espejo Inteligente Cuadrado Q1 Qualika - Touch (Luz Cálida / Fría / Amarilla)"
"Hogar";"Otros hogar";"Qualika";"Espejo Inteligente Rectangular Horizontal Q2 Qualika - Touch + Desempañador + Hora (Luz Cálida / Fría / Amarilla)"
"Hogar";"Otros hogar";"Qualika";"Espejo Inteligente Rectangular Horizontal Q1 Qualika (Luz Calida / Fria / Amarilla)"
"Hogar";"Otros hogar";"Qualika";"Espejo Inteligente Rectangular Vertical Q2 Qualika - Touch + Desempañador + Hora (Luz Calida / Fria / Amarilla)"
"Hogar";"Otros hogar";"Qualika";"Espejo Inteligente Rectangular Vertical Q1 Qualika (Luz Calida / Fria / Amarilla)"
"Suplementos";"Comida proteica";"Granger";"Cookies Proteicas Granger Con Chips De Chocolate"
"Suplementos";"Comida proteica";"Granger";"Pancakes Proteicos Veganos Granger 400g Bajo En Azúcar Sabor Chocolate Suizo"
"Suplementos";"Proteinas";"Granger";"Colageno Hidrolizado Beauty Granger Sabor Naranja Naranja"
"Suplementos";"Vitaminas y Salud";"Granger";"Colágeno Flex Granger 250g Sabor Naranja"
"Suplementos";"Vitaminas y Salud";"Granger";"Chia Puddings Granger Sin Azucar Omega 3 Sabor Chocolate"
"Suplementos";"Creatinas";"Granger";"Creatina Monohidrato Micronizada Granger 300grs 100% Pura Sin Sabor"
"Suplementos";"Comida proteica";"Granger";"Omelette Proteico Granger 210g"
"Suplementos";"Comida proteica";"Granger";"Cupcakes Proteicos Chocolate 360 Gramos Granger"
"Suplementos";"Quemadores";"Granger";"Cupcake Keto Granger Chocolate / Vainilla 200g"
"Suplementos";"Comida proteica";"Granger";"Pancakes Proteicos Sabor Vainilla Granger 400 G"
"Suplementos";"Vitaminas y Salud";"Innovanaturals";"Innovanaturals Astaxantina 10mg 60 Cápsulas Sin Sabor"
"Supermercado";"Otros alimentos";"Nonisec";"Pack X 6 Zalea Descartable Nonisec X 10 Unidades"
"Supermercado";"Snacks";"Entrenuts";"Pasta De Mani Entrenuts Natural 1 Kg"
"Supermercado";"Otros alimentos";"Nonisec";"Nonisec Zaleas Descartables 60x90 Paquete X 10unidades"
"Suplementos";"Vitaminas y Salud";"Innovanaturals";"Coenzima Q10 30 Caps Innovanaturals Sin Sabor"
"Supermercado";"Otros alimentos";"Dicomere";"Pasa de Uva Dicomere Bolsa x 1 kg 2X1!!!"
"Supermercado";"Otros alimentos";"Dicomere";"Mix de Frutas Secas Premium Dicomere Bolsa x 1 kg 2X1!!!"
"Supermercado";"Almacén";"Entrenuts";"Aceite de Coco Neutro 360cc Entrenuts 3X1!!"
"Supermercado";"Almacén";"Entrenuts";"Aceite de Coco Virgen 360cc Entrenuts 3X1!!"
"Suplementos";"Creatinas";"Natural Whey";"Creatina Pura Monohidratada 500g Natural Whey Suplemento Deportivo Polvo Característico"
"Suplementos";"Creatinas";"Natural Whey";"Creatina Monohidrato Micronizada 1 Kg Sin Sabor Natural Whey Sin Sabor"
"Suplementos";"BCAA-Aminos";"Body Advance";"Aminoacidos Esenciales - Eaa Amin9 - Body Advance"
"Suplementos";"Creatinas";"Body Advance";"Suplemento Creatina Glutamina Body Advance Creagline Sin Sabor 150g"
"Suplementos";"Pre-entrenos";"Body Advance";"Nitrix Bomb Aminoácidos 90 Comprimidos - Body Advance Neutro"
"Suplementos";"Saborizantes";"Main Fusion";"Jarabe Main Fusion Sabor Pistacho 1 Litro"
"Suplementos";"Vitaminas y Salud";"Labs Nutrition";"Citrato De Potasio 400mg Labs Nutrition 60 Cápsulas Sin Sabor"
"Suplementos";"Pre-entrenos";"Body Advance";"Pre Entreno Body Advance Beast Blood 280g Sabor Tutti Frutti"
"Suplementos";"Vitaminas y Salud";"Labs Nutrition";"Colágeno Labs Nutrition Con Ácido Hialurónico Sin Sabor 60c Neutro"
"Suplementos";"Vitaminas y Salud";"Labs Nutrition";"Ácido Hialurónico Labs Nutrition 60 Cápsulas Sin Sabor"
"Suplementos";"Vitaminas y Salud";"Labs Nutrition";"Melaton 500 Mg Labs Nutrition Cápsulas 30 Unid Suplemento Sueño Sin Sabor"
"Suplementos";"Vitaminas y Salud";"Labs Nutrition";"Multi Magnesio 500mg 60 Cáps Labs Nutrition Alto Absorción Sin Sabor"
"Suplementos";"Vitaminas y Salud";"Labs Nutrition";"Regulador Hormonal Femenino Lady Balance 60 Cápsulas Menopausia Sin Sabor"
"Suplementos";"Saborizantes";"Body Advance";"Creatina Micronizada Body Advance 300g Saborizada"
"Suplementos";"Proteinas";"Ena";"Plant Protein Ena Vegana"
"Suplementos";"Creatinas";"Star Nutrition";"Creatina Monohidratada Star Nutrition 300 Gr - Doypack Sabor Frutos Rojos"
"Suplementos";"Proteinas";"Ena Sport";"Ena Sport True Made Proteína Polvo 453 G Sin Sabor Sin Sabor"
"Bananero";"El Bananero";"Perro Callejero";"Vino Perro Callejero Pinot Noir 750Ml"
"Bananero";"El Bananero";"Perro Callejero";"Vino Perro Callejero Blend De Sauvignon Blanc 750 Ml"
"Bodega";"Bodega";"Mosquita Muerta";"Mosquita Muerta Blend De Tintas Estuche 3 Litros"
"Supermercado";"Almacén";"Natural Nutrition";"Aceite De Coco Natural Nutrition 60 Comprimidos Wellness Sin Sabor"
"Suplementos";"BCAA-Aminos";"Gold Nutrition";"Gold Nutrition Testo Gold 120 Caps Aminoácidos"
"Suplementos";"Vitaminas y Salud";"Gold Nutrition";"Gold Nutrition Omega 3 Fish Oil Dha & Epa Suplemento 30c"
"Suplementos";"BCAA-Aminos";"Gold Nutrition";"Glutamina X 225g Micronizada Sin Sabor Gold Nutrition Sin Sabor"
"Suplementos";"Vitaminas y Salud";"Gold Nutrition";"Gold Nutrition Multivitamínico 30 Cápsulas"
"Suplementos";"Proteinas";"Gold Nutrition";"100% Whey Protein X5lbs - Gold Nutrition Sabor Strawberry Shake"
"Suplementos";"Creatinas";"Woman Supplements";"Woman Creatina Monohidrato Micronizada Sin Sabor 300gr Sin Sabor"
"Suplementos";"Vitaminas y Salud";"Labs Nutrition";"Picolinato De Cromo 250mcg Labs Nutrition 60 Cápsulas Sin Sabor"
"Suplementos";"Proteinas";"Gold Nutrition";"Gold Nutrition Whey Protein 2lb Potencia Rendimiento Sin Sabor Pura Sin Agregados Suplemento Proteina Muscular"
"Suplementos";"Vitaminas y Salud";"Labs Nutrition";"Vitaminas D3 K2 Labs Nutrition 60 Cápsulas Veganas Colecalciferol Sin Sabor"
"Suplementos";"Proteinas";"Gold Nutrition";"Iso Protein Gold Nutriton Sabor Gourmet 908g"
"Suplementos";"Vitaminas y Salud";"Labs Nutrition";"Spirulina 500mg 60 Cápsulas Sin Sabor Labs Nutrition Antioxidante"
"Suplementos";"Vitaminas y Salud";"Labs Nutrition";"Malato Magnesio Labs Nutrition Cápsulas 500mg Suplemento Nutricional Sin Sabor"
"Suplementos";"Vitaminas y Salud";"Labs Nutrition";"Capsulas Gingko Biloba 500mg Labs Nutrition Suplemento Cognitivo Sin Sabor"
"Suplementos";"Proteinas";"Natural Whey";"Curcuma Pura En Polvo 500 Gramos Natural Whey"
"Suplementos";"Vitaminas y Salud";"Labs Nutrition";"Cúrcuma Con Jengibre 500mg Labs Nutrition 60 Cápsulas Sin Sabor"
"Suplementos";"Pre-entrenos";"Labs Nutrition";"Suplemento Akg Labs Nutrition 60 Cápsulas 30g Sin Sabor"
"Suplementos";"Vitaminas y Salud";"Labs Nutrition";"Aceite De Romero Labs Nutrition 30ml Estimulante Capilar Piel Orgánico"
"Suplementos";"Vitaminas y Salud";"Labs Nutrition";"Aceite Esencial De Orégano Labs Nutrition (30ml)"
"Suplementos";"Vitaminas y Salud";"Labs Nutrition";"Msm Cápsulas Labs Nutrition 60 Unidades Suplemento Sin Sabor Sin Sabor"
"Suplementos";"Vitaminas y Salud";"Labs Nutrition";"Suplemento En Cápsula Labs Nutrition Vitamina B8 De Inositol De 30 Un Sin Sabor"
"Suplementos";"Vitaminas y Salud";"Labs Nutrition";"Ácido Alfa Lipoico 500mg Antioxidante 60 Cápsulas Labs Nutrition Orgánico Sin Sabor"
"Suplementos";"BCAA-Aminos";"Labs Nutrition";"Glicina 500mg Capsulas Labs Nutrition 60 Unidades Aminoácidos Sin Sabor"
"Suplementos";"Proteinas";"Gold Nutrition";"Vegetal Protein Isolate 2lbs 100% B12 Gold Nutrition Vegan Sabor Chocolate"
"Suplementos";"Proteinas";"Gold Nutrition";"Proteína Vegana Gold Nutrition Vainilla 907g Polvo Vainilla"
"Supermercado";"Snacks";"Beepure";"Mermelada de Arandanos 270g Beepure"
"Supermercado";"Almacén";"Laur";"Aceite De Oliva Laur Virgen Extra Arbequina Lata 1lt"
"Supermercado";"Almacén";"Laur";"Laur Aceite De Oliva Virgen Extra Blend De Terroir 500 Ml"
"Suplementos";"Creatinas";"Ena";"Creatina Monohidrato Con Electrolitos Ena Sport 293g Blue Lemon"
"Supermercado";"Almacén";"Entrenuts";"Aceite De Coco Neutro X 200 Cc - Entrenuts 2x1!!!! Mirar Descripcion"
"Bodega";"Bodega";"Baldo";"Yerba Mate Baldo Original Brasil Premium 500g/1kg/5kg"
"Supermercado";"Otros alimentos";"Natural Nutrition";"Cla Acido Linoleico 60 Capsulas Natural Nutrition Neutro"
"Supermercado";"Snacks";"Natural Nutrition";"Proteina Aislada De Soja Natural Nutrition 907g Premium Cookies And Cream"
"Supermercado";"Otros alimentos";"Natural Nutrition";"Proteina Aislada De Soja Natural Nutrition 907g Premium Milkshake"
"Suplementos";"BCAA-Aminos";"Optimum Nutrition";"Essential Amin.o. Energy+ Electrolytes Sparkling 355ml Blue / Strawberry"
"Supermercado";"Almacén";"Entrenuts";"Miel Liquida Entrenuts Sin Tacc Kosher 500g 2X1!! MIRAR DESCRIPCION"
"Supermercado";"Almacén";"Entrenuts";"Miel Cremosa Entrenuts Sin Tacc Kosher 500g 2x1!!!! Mirar Descripcion"
"Suplementos";"BCAA-Aminos";"Pgn";"Pgn Andino Obesidad Con Fucus, Hisopo,uva Ursi Y L-carnitina Sin Sabor"
"Suplementos";"Vitaminas y Salud";"Pgn";"Pgn Andino Digestivo Alcachofa, Zanahoria, Boldo Y Metionina Sin Sabor"
"Suplementos";"BCAA-Aminos";"Pgn";"Pgn Andino Re-vital Guarana, Ginseng Y L-glutamina Sin Sabor"
"Suplementos";"Vitaminas y Salud";"Pgn";"Pgn Andino Varices Castaño De India, Hammamelis, Sin Sabor"
"Suplementos";"Vitaminas y Salud";"Pgn";"Pgn Andino Insomio Valeriana, Pasiflora Y Vitamina B6 Sin Sabor"
"Suplementos";"Vitaminas y Salud";"Pgn";"Pgn Andino Laxante Con Plantago, Malva Y Magnesio Sin Sabor"
"Suplementos";"BCAA-Aminos";"Pgn";"Pgn Andino Presion Alta Ortiga, Pasiflora, Ajo Y Taurina Sin Sabor"
"Suplementos";"BCAA-Aminos";"Pgn";"Pgn Andino Urico Romero, Uva Ursi Y Citrulina Sin Sabor"
"Suplementos";"BCAA-Aminos";"Pgn";"Pgn Andino Inmunologico Con Te Verde, Ginkgo Y Arginina N8 Sin Sabor"
"Suplementos";"BCAA-Aminos";"Pgn";"Pgn Andino Circulatorio Lapacho Hamamelis E Isoleucina N27 Sin Sabor"
"Suplementos";"BCAA-Aminos";"Pgn";"Pgn Andino Digestivo Cola De Caballo, Manzanilla Y Taurina Sin Sabor"
"Suplementos";"Vitaminas y Salud";"Pgn";"Pgn Andino Reumatismo Ulmaria, Manzanilla, Vitaminas B1 Y B6 Sin Sabor"
"Suplementos";"Vitaminas y Salud";"Pgn";"Pgn Andino Parasitos Cuasia, Ajo Y Vitamina C Sin Sabor"
"Suplementos";"Vitaminas y Salud";"Pgn";"Pgn Andino Asma Con Ambay, Eucalipto, Regaliz Y Vitamina C Sin Sabor"
"Suplementos";"BCAA-Aminos";"Pgn";"Pgn Andino Celulitis Con Centella, Fucus Y L-carnitina Sin Sabor"
"Suplementos";"Vitaminas y Salud";"Pgn";"Pgn Andino Ansiolitico Valeriana, Pasiflora, Melisa Y Vit B6 Sin Sabor"
"Suplementos";"BCAA-Aminos";"Pgn";"Pgn Andino Acidez Ulcera Calendula Ginkgo Y Taurina Sin Sabor"
"Suplementos";"Vitaminas y Salud";"Pgn";"Pgn Andino Migraña Ulmaria, Tilo Y Acido Aspartico Sin Sabor"
"Suplementos";"Vitaminas y Salud";"Pgn";"Pgn Andino Antiespamodico Manzanilla Pasiflora Y Magnesio Sin Sabor"
"Suplementos";"Vitaminas y Salud";"Pgn";"Pgn Andino Menopausia Soja, Salvia Y Vitamina B1 Sin Sabor"
"Suplementos";"BCAA-Aminos";"Pgn";"Pgn Andino Neuroactivador Ginkgo, Ginseng Y L-glutamina Sin Sabor"
"Suplementos";"Vitaminas y Salud";"Pgn";"Venostil Pgn 30 Cápsulas Castaño De Indias + Vit C Neutro"
"Suplementos";"Vitaminas y Salud";"Pgn";"Pharmahepat Pgn X 20 Caps Digestivo Natural Sabor Sin Sabor"
"Suplementos";"BCAA-Aminos";"Pgn";"Pgn Andino Energizante Guarana Y Arginina Sin Sabor"
"Suplementos";"Creatinas";"Pgn";"Suplementos Creatinas Con Vitamina C Pgn X 100 Capsulas Sin Sabor"
"Suplementos";"Vitaminas y Salud";"Pgn";"Pgn Andino Hepatico Alcachofa, Bardana Y Acido Aspartico Sin Sabor"
"Suplementos";"Vitaminas y Salud";"Pgn";"Pgn Andino Tonico Cerebral Con Lapacho, Salvia, Y Glicina Sin Sabor"
"Suplementos";"BCAA-Aminos";"Pgn";"Aminoácidos Totales Pgn X 100 Capsulas Sin Sabor Sin Sabor"
"Suplementos";"BCAA-Aminos";"Pgn";"Pgn Andino Colesterol Palta, Fucus, Carnitina Y Acido Folico Sin Sabor"
"Suplementos";"Vitaminas y Salud";"Pgn";"Pgn Andino Diabetes Con Arandano, Bardana Y Niacina Sin Sabor"
"Suplementos";"Vitaminas y Salud";"Pgn";"Uña De Gato Uncaria Tomentosa X 120ml Laboratorio Pgn Una De Sin Sabor"
"Suplementos";"Vitaminas y Salud";"Pgn";"Cardio Magnesio Pgn 30 Caps Con Magnesio, Potasio, Omega 3 Sin Sabor"
"Suplementos";"Quemadores";"Pgn";"PGN Andino - Extractos Herbales en Gotas | 30 Fórmulas Naturales (Estrés, Obesidad, Digestión, Colesterol, Laxante, Insomnio)"
"Suplementos";"Vitaminas y Salud";"Pgn";"Pgn Andino Gripe Eucalipto, Ambay Y Vitamina C Sin Sabor"
"Suplementos";"BCAA-Aminos";"Pgn";"Aminoácidos Totales Pgn X 30 Capsulas Sabor Sin Sabor Sin Sabor"
"Suplementos";"Vitaminas y Salud";"Pgn";"Pgn Andino Cistitis Arandano, Ortiga Y Zinc Sin Sabor"
"Suplementos";"Vitaminas y Salud";"Pgn";"Pgn Andino Colesterol Palta, Fucus,carinitina Y Acido Folico Sin Sabor"
"Suplementos";"Vitaminas y Salud";"Pgn";"Pgn Andino Diuretico Uva Ursi, Cola De Caballo, Vitamina B6 Sin Sabor"
"Suplementos";"Vitaminas y Salud";"Pgn";"Pgn Suplemento Dietario A Base De Melena De Leon"
"Suplementos";"Vitaminas y Salud";"Pgn";"Suplemento En Polvo Full Complex Colmillot Pgn 300g En Pote Vainilla"
"Suplementos";"Vitaminas y Salud";"Vits";"Magnesio Complex Vits 120 Cápsulas"
"Suplementos";"Vitaminas y Salud";"Vits";"Vitaminas Para El Cabello Multivitaminas Para Pelo, Piel Y Uñas 60 Cápsulas"
"Suplementos";"Vitaminas y Salud";"Vits";"Omega 3 2000mg Vits 60 Cápsulas Blandas Aceite De Pescado"
"Suplementos";"Vitaminas y Salud";"Vits";"Vitamina C 1000mg + Zinc 120 Cápsulas"
"Suplementos";"Vitaminas y Salud";"Vits";"Citrato De Magnesio Vits 120 Cápsulas Con Vitamina D"
"Suplementos";"Vitaminas y Salud";"Vits";"Cúrcuma + Pimienta Negra + Jengibre Vits 120 Cápsulas Sin Sabor"
"Suplementos";"Pre-entrenos";"Optimum Nutrition";"3x1 Optimum Nutrition AMIN.O Energy Pre Entreno con BCAA y Té Verde Sabor Fruit Fusion MIRAR DESCRIPCION!!"
"Suplementos";"Pre-entrenos";"Labs Nutrition";"Óxido Nítrico Labs Nutrition 60 Cápsulas Sin Sabor"
"Supermercado";"Bebidas alcohólicas";"Menoyo";"Vinagre De Vino Menoyo Botella/Bidon"
"Suplementos";"Vitaminas y Salud";"Labs Nutrition";"Citrato De Magnesio 400 Mg (60 Capsulas) Sin Sabor"
"Supermercado";"Otros alimentos";"Natuliv";"Natuliv Vitamina C Comprimidos X 30 Unidades Sin Sabor"
"Suplementos";"Vitaminas y Salud";"Labs Nutrition";"Vitamina C - Acido Ascórbico 500 Mg 60 Caps Sin Sabor"
"Supermercado";"Almacén";"Menoyo";"Salsa De Soja Menoyo Menoyo 500ml"
"Supermercado";"Almacén";"Menoyo";"Mostaza Menoyo Sin Tacc Sachet 2.5 Kg"
"Suplementos";"Vitaminas y Salud";"Ena Sport";"Enacción Multivitamínico Ena X 60 Comprimidos Sin Sabor"
"Supermercado";"Otros alimentos";"Natuliv";"Natuliv Magnesio 400 X30 Comprimidos Sin Sabor"
"Suplementos";"Vitaminas y Salud";"Ena Sport";"Enaccion X 30 Comp Multivitaminico Sabor Neutro"
"Suplementos";"Vitaminas y Salud";"Labs Nutrition";"Resveratrol X 60 Capsulas Sabor Sin Sabor"
"Suplementos";"Vitaminas y Salud";"Labs Nutrition";"Ashwagandha Labs Nutrition 60c Sin Sabor"
"Supermercado";"Snacks";"Entrenuts";"Pasta De Mani Protein Salted Caramel Entrenuts 370g Vegano"
"Supermercado";"Otros alimentos";"Natuliv";"Suplemento En Comprimidos Natuliv Magnesio X 24.3g Sin Sabor"
"Supermercado";"Otros alimentos";"Natuliv";"Natuliv Suplemento Vitaminico Vitamina D X 30c Neutro"
"Suplementos";"Vitaminas y Salud";"Ena Sport";"Enacción Colágeno Move X 30 Comp. Ena Sabor Sin Sabor Neutro"
"Suplementos";"Vitaminas y Salud";"Labs Nutrition";"Malato De Magnesio 500mg - Energía, Relajación (60 Caps) Sin Sabor"
"Suplementos";"Vitaminas y Salud";"Labs Nutrition";"Glicinato De Magnesio 500 Mg (60 Capsulas) Sin Sabor"
"Supermercado";"Otros alimentos";"Menoyo";"Aceto Balsamico En Reduccion Original Menoyo Aderezo Cremoso"
