"Vertical";"SubTipo";"Marca";"Nombre"
"Supermercado";"Cuidado personal";"SriSri";"Incienso Conos Sri Sri Tattva Fragancia Surya"
"Supermercado";"Cuidado personal";"SriSri";"Incienso Cono Canela - Calma - Srisri Tattva"
"Supermercado";"Otros alimentos";"SriSri";"Varilla Sri Sri Tattva Sticks Fragancia Dicha X 12 Unidades"
"Supermercado";"Otros alimentos";"SriSri";"Sahumerios Sri Sri Ayurveda India - Pacha Kuyuy Fragancia Mil Flores"
"Supermercado";"Otros alimentos";"SriSri";"Varilla Sri Sri Tattva Intense Sticks Fragancia Canela En Caja X 12 Unidades 30g"
"Supermercado";"Otros alimentos";"SriSri";"Sahumerios Premium Srisri De Flores Y Aromas De La India Fragancia Kewda"
"Suplementos";"Vitaminas y Salud";"Ena";"Ena Pure Collagen Truemade Acido Hialurónico Lemonade 360g Sabor Limón"
"Supermercado";"Otros alimentos";"SriSri";"Bálsamo Labial Sri Sri Tattva"
"Supermercado";"Almacén";"Laur";"Aceite Oliva Laur Extra Virgen 1l X6"
"Supermercado";"Otros alimentos";"Every Day Nature";"Citrato De Magnesio 1 Kg Puro Xebell Calidad Suplemento"
"Supermercado";"Otros alimentos";"Every Day Nature";"Colageno Hidrolizado Polvo Puro 1 Kg Xebell Sin Sabor Peptid Sabor Característico"
"Supermercado";"Otros alimentos";"Every Day Nature";"Citrato De Potasio 1 Kg Puro Xebell Usp Calidad Premium Sabor Característico"
"Supermercado";"Otros alimentos";"Every Day Nature";"Vitamina C 1 Kg Acido Ascorbico Xebell Usp Pura Sabor Característico"
"Suplementos";"Accesorios";"InnovaNaturals";"Suplemento En Cápsula Innovanaturals Suplemento Nutricional Omega 3 Sabor Neutro 6 Packs De 60 Legend Nutrition Pastillero"
"Supermercado";"Otros alimentos";"Dicomere";"Premezcla Para Pan Sin Tacc Dicomere Psyllium Husk 450gr"
"Suplementos";"Proteinas";"Nutrilab";"Whey Protein Nutrilab - Whey Pro 2.0 Classic Line. 5kg 25% DE DESCUENTO"
"Supermercado";"Otros alimentos";"Dicomere";"Dicomere Fish Masala (sin Tacc) - Sobres X25 50gr"
"Supermercado";"Otros alimentos";"Dicomere";"Garam Masala (sin Tacc) - Sobres X25 50gr"
"Suplementos";"Creatinas";"Ena";"Creatina Monohidrato 5grs + Electrolitos 335mg Ena Energia Sabor Pink Lemonade"
"Supermercado";"Otros alimentos";"Dicomere";"Harina De Lenteja Sin Tacc Dicomere 450 G"
"Supermercado";"Otros alimentos";"Dicomere";"Harina De Arvejas Sin Tacc X 450 Gr - Dicomere"
"Suplementos";"Proteinas";"Gold Nutrition";"Vegetal Protein Isolate 2lbs 100% B12 Gold Nutrition Vegan Sabor Neutro"
"Suplementos";"Creatinas";"Gold Nutrition";"Creatina Creapure 200g 100% - Gold Nutrition Sabor Sin Sabor"
"Suplementos";"Accesorios";"Natural Whey";"Natural Whey Citrato De Potasio 60 Capsulas + Pastillero Legend Nutrition"
"Suplementos";"Accesorios";"Natural Whey";"Citrato De Magnesio Puro 60 Capsulas Natural Whey + Pastillero Legend Nutrition"
"Suplementos";"Accesorios";"Natural Whey";"Suplemento En Cápsula Natural Whey Suplementos Glicinato De Magnesio En Doypack 60 Capsulas + Pastillero Legend Nutrition"
"Suplementos";"Creatinas";"Star Nutrition";"Suplemento En Polvo Star Nutrition Creatine Monohydrate En Pote De 300g Sin Sabor X3 + Vaso Legend Nutrition"
"Supermercado";"Otros alimentos";"Felfort";"Bombón Licorfort Felfort X30u"
"Supermercado";"Snacks";"Felfort";"Barra Cereal Fort Granrico Caja 24 Unidades."
"Supermercado";"Otros alimentos";"Felfort";"Bombon Cericet Felfort X 12u Felfort"
"Supermercado";"Snacks";"Felfort";"Barra Cereal Fort Manzana Y Almendras Caja 24 Unidades."
"Supermercado";"Snacks";"Felfort";"Bombon Jackelin Felfort X 30u Con Muchisimo Dulce De Leche"
"Suplementos";"Accesorios";"Universal Nutrition";"Frasco Daily Formula X 100 Tabs Vitaminas Y Minerales Universal Nutrition Sin Sabor Pack X2+ Pastillero Legend Nutrition"
"Suplementos";"Accesorios";"Universal Nutrition";"Frasco Daily Formula X 100 Tabs Vitaminas Y Minerales Universal Nutrition Sin Sabor + Pastillero Legend Nutrition"
"Suplementos";"Accesorios";"Star Nutrition";"Arginina Gh Star Nutrition 150g En Polvo Sin Sabor + Pastillero Legend Nutrition"
"Suplementos";"Accesorios";"InnovaNaturals";"Innovanaturals Suplemento Nutricional Omega 3 Sabor Neutro 12 Packs De 60 Unidades Con Pastillero Legend Nutrition"
"Suplementos";"Creatinas";"Nutrilab";"2x Creatina Nutrilab Crea Shock X 300 Grs Fuerza Volumen En Polvo Sabor Uva Legend Nutrition Vaso 600ml"
"Suplementos";"BCAA-Aminos";"Ena";"Reload Ena Sport Post Entrenamiento Recuperación Limonada"
"Suplementos";"Accesorios";"Leguilab";"L-teanina Cafeína Vitamina B6 Brain Focus Leguilab 60 Capsulas Pack X2 Pastillero Legend Nutrition"
"Suplementos";"Vitaminas y Salud";"Leguilab";"Azafran + Vitamina B6 30 Caps - Leguilab Sabor Sin Sabor"
"Suplementos";"Vitaminas y Salud";"Leguilab";"Curcuma 95% Curcuminoides 30 Caps Leguilab"
"Suplementos";"Vitaminas y Salud";"Leguilab";"Suplemento En Cápsulas Leguilab Coenzima Q10 X 30g"
"Suplementos";"Proteinas";"Natural Whey";"Bisglicinato de Magnesio 500g Natural Whey 2x1!!"
"Suplementos";"Creatinas";"Ena";"Suplemento En Polvo Ena Sport Creatina Monohidrato 100% Pura En Doypack De 342g Sabor Naranja Micronizada"
"Suplementos";"Accesorios";"Universal Nutrition";"Multivitaminico Animal Pak 44 Paquetes Universal Nutrition Sin Sabor + Pastillero Legend Nutrition"
"Suplementos";"Accesorios";"InnovaNaturals";"Innova Naturals Multivitamínico 3 Unidades X 30 Cápsulas Aporta Vitalidad Y Energía Pastillero Legend"
"Suplementos";"Proteinas";"Woman Supplements";"Protein + Fit By Floppy Tesouro - Proteina Con Colágeno Y Te Verde + Vaso Legend"
"Suplementos";"Proteinas";"Woman Supplements";"Protein + Fit By Floppy Tesouro - Proteina Con Colágeno Y Te Verde"
"Suplementos";"Accesorios";"InnovaNaturals";"Innova Naturals Vitamina K2 + D3 4 Unidades X 30 Cápsulas Pastillero Legend"
"Suplementos";"Accesorios";"InnovaNaturals";"Innova Naturals Vitamina K2 + D3 3 Unidades X 30 Cápsulas Pastillero Legend"
"Suplementos";"Quemadores";"Universal Nutrition";"Animal Advanced Cuts Universal Nutrition 42 Packs"
"Suplementos";"Proteinas";"Vitalgy";"Barras Proteicas De Chocolate Vitalgy 15gr Proteina"
"Suplementos";"Accesorios";"Star Nutrition";"2 Bcaa 2000 X 120 Caps Star Nutrition Aminoácidos Ramificados Sin Sabor Pastillero Legend"
"Suplementos";"Barras y geles";"Vitalgy";"Barras De Cereal Vitalgy Caja 10 X 40g"
"Suplementos";"Proteinas";"Woman Supplements";"Colageno Hidrolizado Woman Supplements 360g Sabor Frutos Rojos + Vaso Legend"
"Suplementos";"Accesorios";"Woman Supplements";"Resveratrol Antioxidante Woman Supplements 60caps + Pastillero Legend"
"Suplementos";"Accesorios";"Nutrex Research";"Lipo 6 Black Keto Nutrex Research 60 Cápsulas Sabor Sin Sabor + Pastillero Legend"
"Suplementos";"Proteinas";"Woman Supplements";"Colageno Hidrolizado Woman Supplements 360g Sabor Frutos Rojos X2 + Vaso Legend"
"Suplementos";"Vitaminas y Salud";"Universal Nutrition";"Animalpak Powder 383g Multivitamínico Berries X2 + Vaso Legend"
"Suplementos";"Vitaminas y Salud";"Universal Nutrition";"Animalpak Powder 383g Multivitamínico Berry + Vaso Legend"
"Suplementos";"Accesorios";"Nutrex Research";"Nutrex Lipo-6 Hers Uc 60 Capsulas Sin Sabor + Pastillero"
"Suplementos";"Pre-entrenos";"Cellucor";"C4 Ripped Pre-entreno 180g Cellucor Sabor Icy Blue Razz X2 + Vaso Legend"
"Suplementos";"Pre-entrenos";"Cellucor";"C4 Original 470g Sabor Icy Blue Raspberry Preworkout 50 Servs + Vaso Legend 600ml"
"Supermercado";"Almacén";"Laur";"Aceite De Oliva Extra Virgen Gran Mendoza Laur Arauco 500ml"
"Supermercado";"Otros alimentos";"Laur";"Aceto Balsámico Millán 250ml Sabor Gourmet Premium"
"Supermercado";"Almacén";"Laur";"Aceite De Oliva Laur Extra Virgen"
"Supermercado";"Otros alimentos";"Laur";"Aceto Balsámico Laur Contraviento Con 500ml"
"Suplementos";"Pre-entrenos";"Cellucor";"C4 Ultimate Preworkout 400g Sabor Icy Blue Razz Cellucor + Vaso Legend 600ml"
"Suplementos";"Accesorios";"Nutrex Research";"Niox 90 Caps Oxido Nitrico, Nutrex Research Sin Sabor X2 + Pastillero Legend"
"Suplementos";"Accesorios";"Nutrex Research";"Niox 90 Caps Oxido Nitrico Nutrex Research Sin Sabor + Pastillero Legend"
"Suplementos";"Pre-entrenos";"Cellucor";"C4 Original 470g Icy Blue Raspberry Preworkout 50 Servs X2 + Vaso Legend"
"Suplementos";"Accesorios";"Nutrex Research";"Lipo6 Black Ultra Concentrate Cafeína 60 Caps Nutrex Pote Sin Sabor X2 + Pastillero Legend"
"Suplementos";"Accesorios";"Nutrex Research";"Lipo-6 Hers Uc Nutrex Fat Burner 60c X2 + Pastillero Legend"
"Suplementos";"Proteinas";"Ultimate Nutrition";"Proteína Prostar 100% Whey 2 Lb Sabor Chocolate Ultimate Nutrition X2 + Vaso Legend 600ml"
"Suplementos";"Proteinas";"Ultimate Nutrition";"Proteína Prostar 100% Whey 2 Lb Sabor Chocolate Ultimate Nutrition + Vaso Legend 600ml"
"Suplementos";"Accesorios";"InnovaNaturals";"Innova Naturals Vitamina K2 + D3 2 Unidades X 30 Cápsulas Pastillero Legend"
"Suplementos";"Creatinas";"Nutrilab";"Crea Shock Nutrilab 300grs Con Cafeína Sabor Naranja Dulce Legend"
"Suplementos";"BCAA-Aminos";"Nutrilab";"Nutrilab Glutamina Ready 300gr Sin Sabor"
"Suplementos";"Pre-entrenos";"Cellucor";"C4 Ultimate Preworkout 400g Sabor Icy Blue Razz Cellucor X2+ Vaso Legend 600ml"
"Hogar";"Otros hogar";"Yelmo";"Horno Eléctrico Yelmo 45 Litros Yl-45an 2 Anafes Color Azul Oscuro"
"Hogar";"Otros hogar";"Yelmo";"Yogurtera Blanco Fabrica De Yogurt Yelmo Yg-1700 7 Jarros Color Blanco"
"Hogar";"Climatización";"Ultracomb";"Pochoclera En 4 Min! Sin Aceites-aire Caliente Color Rojo"
"Hogar";"Licuadoras y batidoras";"Ultracomb";"Licuadora De Mesa Ultracomb Lc-2012 1.5lts Jarra De Vidrio Color Crema"
"Hogar";"Licuadoras y batidoras";"Ultracomb";"Licuadora Ultracomb Lc-2007 1.5 L 650w Jarra Plástico Color Negro"
"Hogar";"Licuadoras y batidoras";"Yelmo";"Licuadora Yelmo Lc-1009 1.5 L Con Jarra De Plástico - Color Celeste"
"Hogar";"Otros hogar";"Yelmo";"Horno De Mesa Eléctrico Yelmo Yl-45n 45l Negro"
"Hogar";"Climatización";"Ultracomb";"Freidora De Aire 14lt Ultracomb 1800w Digital Táctil Fr-8622 Color Negro"
"Hogar";"Limpieza y cuidado";"Ultracomb";"Aspiradora Robot Ultracomb As-6061 Color Antracita/negro"
"Hogar";"Limpieza y cuidado";"UltraComb";"Aspiradora Ultracomb As-4201 1400w 2l Trineo Bolsa Cepillo Color Rojo"
"Hogar";"Limpieza y cuidado";"Yelmo";"Yelmo Aspiradora Robot As-7070 Inteligente Mopa Azul"
"Suplementos";"BCAA-Aminos";"Nutrilab";"Eaa Nitro Polvo Nutrilab Aminoácidos 30 servicios"
"Suplementos";"Quemadores";"Nutrilab";"Lipo Fem Nutrilab 240 Comprimidos Sabor Sin Sabor"
"Suplementos";"BCAA-Aminos";"Nutrilab";"Amino Energy 240 Comprimidos - Nutrilab Muscle Recovery Sabor Sin Sabor"
"Suplementos";"Quemadores";"Nutrilab";"Termogenic Max Nutrilab. 240 Comp. Quemador De Grasa. Sabor Neutro"
"Suplementos";"Accesorios";"Ena";"Suplemento En Polvo Ena Sport Creatina 300g Sabor Fruit Punch + Pastillero Legend X2"
"Supermercado";"Otros alimentos";"SriSri";"Ghee Manteca Clarificada Cows Pure Sri Sri 150 G Sin Tacc"
"Supermercado";"Snacks";"SriSri";"Laddubar Protein Frutos Secos Y Coco Caja X10 Barras Veganas"
"Supermercado";"Snacks";"SriSri";"Caja X12 Barras Laddubar Gold Almendras/Avellanas 30g"
"Suplementos";"Vitaminas y Salud";"Star Nutrition";"Star Nutrition Collagen Plus 360gr En Polvo Sabor Limón + Vaso Legend Nutrition"
"Suplementos";"Vitaminas y Salud";"Star Nutrition";"Star Nutrition Collagen Sport 360gr En Polvo Sabor Naranja + Vaso Legend Nutrition"
"Suplementos";"Pre-entrenos";"Nutrex Research";"Niox 90 Caps Oxido Nitrico, Nutrex Research Sin Sabor"
"Suplementos";"BCAA-Aminos";"Nutrex Research";"Lipo6 Carnitine Quemador De Grasa Nutrex Apoya Dieta 60 Capsulas"
"Suplementos";"BCAA-Aminos";"Universal Nutrition";"Amino Beef 200 Tabs Universal Aminoácido Derivado De Carne"
"Suplementos";"BCAA-Aminos";"Universal Nutrition";"Animal Suplemento En Polvo Nutrition Juiced Aminoácidos 377g"
"Suplementos";"Vitaminas y Salud";"Universal Nutrition";"Potenciador Hormonal Universal Nutrition Animal Stak 21 Pack"
"Suplementos";"Creatinas";"Ultimate Nutrition";"Creatina Ultimate Nutrition Creatina Monohidrato Micronizada 300g Frasco Sin Sabor"
"Suplementos";"BCAA-Aminos";"Ena";"Ena Glutamina Rapida Recuperacion Sabor Neutro Doypack X300gr + Vaso Legend"
"Suplementos";"Proteinas";"Ultimate Nutrition";"Proteína Prostar 100% Whey 2 Lb - Ultimate Nutrition"
"Suplementos";"Pre-entrenos";"Insane Labz";"Psychotic Pre-Entreno 35 Servicios - Insane Labz"
"Suplementos";"Pre-entrenos";"Cellucor";"C4 Ultimate Preworkout Cellucor"
"Suplementos";"Pre-entrenos";"Cellucor";"C4 Ripped Pre-entreno 180g Cellucor"
"Suplementos";"Pre-entrenos";"Cellucor";"Pre Entreno C4 Original Cellucor 470g 50 Servicios Importado"
"Suplementos";"Ganadores de peso";"Ena";"Suplemento Ganador De Peso Ultramass 1.5 Kg Ena Sport Sabor Chocolate + Vaso Legend"
"Suplementos";"Proteinas";"Ena";"Ena Isoprot Sabor Chocolate Mousse 2lb+ Vaso Legend 600ml"
"Suplementos";"Ganadores de peso";"Ena";"Suplemento Ganador De Peso Ultramass 1.5 Kg Sabor Chocolate X2 + Vaso Legend"
"Suplementos";"Proteinas";"Body Advance";"Colágeno Hidrolizado Bebible 300gr Body Advance Zinc Vit Sabor Frutilla + Vaso Legend Nutrition"
"Suplementos";"BCAA-Aminos";"Body Advance";"Glutamina Body Advance X 300 Gr Sabor Sin Sabor + Vaso Legend Nutrition"
"Suplementos";"Pre-entrenos";"Ena";"Oxido Nitrico Pre-work Ena Sport 210g Sabor Naranja X2 + Vaso Legend 600ml"
"Suplementos";"Pre-entrenos";"Ena";"Oxido Nitrico Pre-work Ena Sport 210g Sabor Naranja + Vaso Legend 600ml"
"Suplementos";"Accesorios";"Ena";"Carnitina 1500 Ena Sport 60 Capsulas Sin Sabor + Pastillero Legend"
"Suplementos";"Creatinas";"Ena";"Creatina Creapure 200g Ena Sport Sin Sabor X2 + Vaso Legend 600ml"
"Suplementos";"Accesorios";"Ena";"Carnitina 1500 Ena Sport 60 Capsulas Sin Sabor X2 + Pastillero Legend"
"Suplementos";"Accesorios";"InnovaNaturals";"Innovanaturals Omega 3 Max X2 (60 Cápsulas C/u) Sin Sabor + Pastillero Legend"
"Suplementos";"Creatinas";"Ena";"Creatina Creapure Monohidrato 200g Sin Sabor Ena Sport + Vaso Legend 600ml"
"Suplementos";"Accesorios";"Gold Nutrition";"Vaso Shaker Gold Nutrition Negro"
"Suplementos";"Accesorios";"Gold Nutrition";"Vaso Shaker Gold Nutrition Blanco"
"Suplementos";"Accesorios";"Star Nutrition";"Suplemento En Polvo 3 Resveratrol 500 Star Nutrition 60 Capsulas Antioxidante Sin Sabor Pastillero Legend"
"Suplementos";"Accesorios";"Eth Nutrition";"Eth Nad 1000 + Resveratrol Suplemento 3 Potes X 30 Cápsulas + Pastillero Legend Nutrition"
"Suplementos";"Vitaminas y Salud";"Breaking Lab";"Glicerina Liquida Pura Vegetal 1 Kilo Breaking Lab"
"Hogar";"Limpieza y cuidado";"Ultracomb";"Secador De Pelo Ultracomb Sc-4609 1200w Color Negro"
"Hogar";"Cocina eléctrica";"Yelmo";"Sandwichera Waflera Donuts Tortas Bagel 3 En 1 Yelmo Sw-1801 Color Blanco"
"Hogar";"Otros hogar";"Ultracomb";"Exprimidor Marca Ultracomb Modelo Ex-2302 Color Blanco/rojo"
"Hogar";"Cocina eléctrica";"Yelmo";"Cafetera Yelmo Ca-7108 Semi Automática Negra De Filtro"
"Hogar";"Cocina eléctrica";"Ultracomb";"Cafetera Espresso Marca Ultracomb Modelo Ce-6108 Color Rojo"
"Suplementos";"Proteinas";"Gold Nutrition";"Vegetal Protein Isolate 2lbs 100% B12 Gold Nutrition Vegan Sabor Manzana"
"Suplementos";"Accesorios";"InnovaNaturals";"Innova Naturals Omega 3 En Capsulas 30 Caps Sin Sabor X2 + Pastillero Legend Nutrition"
"Suplementos";"Accesorios";"Ena";"Suplemento En Polvo Ena Sport Creatina 300g Sabor Neutro + Pastillero Legend X2"
"Suplementos";"Vitaminas y Salud";"Ena";"Ena Enaccion Colageno Sabor Naranja Sobres 12 Gr X 10 Un"
"Suplementos";"Accesorios";"InnovaNaturals";"Innova Naturals Omega 3 En Capsulas 30 Caps Pastillero Legend Nutrition"
"Bananero";"El Bananero";"Japi";"Cajapi Japi Beer Edición Especial de Colección 2 Latas + Vaso - Lager, IPA, Amber o Porter"
"Supermercado";"Otros alimentos";"Natuliv";"Natuliv Citrato De Magnesio Polvo Sabor Limonada X105gr"
"Suplementos";"Creatinas";"Ena";"Creatina Creapure Monohidrato Ena Sport En Pote 200grs Sabor Sin Sabor"
"Suplementos";"Proteinas";"Ena";"Suplemento Ena Sport Whey Protein Isoprot 907g En Polvo"
"Suplementos";"Proteinas";"Ena";"Ena Protein Nutrición Activa Caja 12 Sobres 25g C/u Sabor Chocolate"
"Supermercado";"Otros alimentos";"Natuliv";"Natuliv Vitamina C X15 Sobres Refuerza Sistema Inmune Sabor Naranja"
"Supermercado";"Otros alimentos";"Natuliv";"Natuliv Arándanos Antioxidante Por Excelencia 60 Capsulas Sabor Sin Sabor"
"Suplementos";"BCAA-Aminos";"Ena";"Carnitina 1500 Ena . 60 Caps. Sabor Sin Sabor"
"Suplementos";"Barras y geles";"Ena";"Suplemento Ena Enargy Gel Sin Cafeína Caja X6 Unidades"
"Suplementos";"Pre-entrenos";"Ena";"Óxido Nítrico (210 Grs) - Ena Sport Aumento De Masa Sabor Naranja"
"Suplementos";"BCAA-Aminos";"Ena";"Amino 4500 X 150 Caps - Ena Aminoacidos"
"Suplementos";"Pre-entrenos";"Ena";"Ena Pre War Energizante Pre Entrenamiento 400g - Lemonade"
"Suplementos";"Proteinas";"Ena";"Truemade Whey Collagen Ena Sport 1,7 Lb Proteina Y Colágeno Sabor Chocolate"
"Suplementos";"Ganadores de peso";"Ena";"Ena Super Ultra Mass Suplemento en Polvo 1500g"
"Suplementos";"Accesorios";"Gold Nutrition";"Zma En Capsulas Gold Nutrition X2 Pastillero Legend"
"Suplementos";"Accesorios";"Gold Nutrition";"Zma En Capsulas Gold Nutrition Pastillero Legend"
"Suplementos";"Accesorios";"Gold Nutrition";"Suplementos En Capsulas Citrato De Magnesio Gold Nutrition X4 Pastillero Legend Nutrition"
"Suplementos";"Accesorios";"Gold Nutrition";"Suplementos En Capsulas Citrato De Magnesio Gold Nutrition X3 Pastillero Legend Nutrition"
"Suplementos";"Accesorios";"Gold Nutrition";"Citrato De Magnesio Gold Nutrition 60 Capsulas Pastillero Legend Nutrition"
"Suplementos";"Combos";"Star Nutrition";"Combo Star Nutrition Creatina 300G + Whey Protein 2LB + Bcaa 270G Sabor Grape Attack"
"Suplementos";"Vitaminas y Salud";"Star Nutrition";"Citrato De Magnesio En Polvo 500g Star Nutrition + Vaso Legend"
"Suplementos";"Combos";"Star Nutrition";"Citrato De Magnesio En Polvo 500g Star Nutrition Pack X2 + Vaso Legend"
"Suplementos";"Proteinas";"Star Nutrition";"Star Nutrition Whey Protein 2lbs + Doypack Whey Protein 2lbs"
"Suplementos";"Creatinas";"Star Nutrition";"Star Nutrition Whey Protein 907g + Creatina Monohidratada 300g"
"Suplementos";"Pre-entrenos";"Star Nutrition";"Pre Entrenamiento Pump V8 Pre Workout Star Nutrition 285 Gr Sabor Watermelon Vaso Legend Nutrition 600ml"
"Suplementos";"Proteinas";"Star Nutrition";"Star Nutrition Whey Protein 2 Lb + Quemador Thermo Fuel 120 Capsulas"
"Suplementos";"Quemadores";"Star Nutrition";"Star Nutrition Thermo Fuel Quemador De Grasa 120 Caps. X5 Un Sabor Neutro"
"Suplementos";"Proteinas";"Star Nutrition";"Star Nutrition Whey Protein 2 Lb + Quemador Thermo Fuel X 120 Cápsulas Sabor Strawberry Cream"
"Suplementos";"Proteinas";"Star Nutrition";"Suplemento En Polvo Star Nutrition Whey Protein 908gr Frutilla Legend 600ml"
"Suplementos";"Proteinas";"Star Nutrition";"Suplemento En Polvo Star Nutrition Whey Protein 908gr Sabor Vainilla Vaso Legend 600 Ml"
"Suplementos";"BCAA-Aminos";"Star Nutrition";"2 Bcaa 2000 X 120 Caps Star Nutrition Aminoácidos Ramificados Sin Sabor"
"Suplementos";"Accesorios";"Star Nutrition";"Mutant Mass Star Nutrition 1,5kg X2 U + Creatina 300 Gr X2 U Sabor Vainilla Ice Cream + Vaso Shaker Legend 600ml"
"Suplementos";"Accesorios";"Star Nutrition";"Star Nutrition - Mutant Mass 5kg X2 Cookies + Vaso Shaker Antigrumos Legend 600ml"
"Suplementos";"Accesorios";"Star Nutrition";"Star Nutrition - Mutant Mass 5kg X2 Frutilla + Vaso Shaker Antigrumos Legend 600ml"
"Suplementos";"Proteinas";"Star Nutrition";"Proteina Whey Star Nutrition 1 Kg X 4 Unidades Sabor Frutilla"
"Suplementos";"Creatinas";"Star Nutrition";"Suplemento Star Nutrition Whey Protein 3kg Sabor Vainilla Creatina Monohidratada 500gr Vaso Legend Nutrition 600ml"
"Suplementos";"Pre-entrenos";"Star Nutrition";"Pre Entreno Tnt Dynamite Star Nutrition 240g Pre Workout Sabor Citrus Slush"
"Suplementos";"Creatinas";"Star Nutrition";"Star Nutrition Whey Protein Sabor Banana 908g Creatina Pura Doypack 300g Vaso Legend 600ml"
"Suplementos";"Combos";"Star Nutrition";"Combo Star Nutrition Creatina 300gr+bcaa 270gr+w Protein 2lb Sabor Grapeattack Y Frutilla"
"Suplementos";"Combos";"Star Nutrition";"Combo Star Nutrition Creatina 300gr+bcaa 270gr+w Protein 2lb Sabor Grapeattack Y Banana"
"Suplementos";"Combos";"Star Nutrition";"Combo Star Nutrition Creatina 300gr+bcaa 270gr+w Protein 2lb Sabor Grapeattack Y Cookies"
"Suplementos";"Combos";"Star Nutrition";"Combo Star Nutrition Creatina 300gr+bcaa 270gr+w Protein 2lb Sabor Blueraz Y Banana"
"Suplementos";"Combos";"Star Nutrition";"Combo Star Nutrition Creatina 300gr+bcaa 270gr+w Protein 2lb Sabor Blueraz Y Cookies"
"Suplementos";"Combos";"Star Nutrition";"Combo Star Nutrition Creatina 300G + Proteina Whey Protein 2lb + Mtor Bcaa 270g Blue Razz"
"Suplementos";"Proteinas";"Star Nutrition";"Proteina Whey Star Nutrition 2 Lb + Mtor 270 Gr Sabor Vanilla Ice Cream + Watermelon"
"Suplementos";"Proteinas";"Star Nutrition";"Proteina Whey Star Nutrition 2 Lb + Mtor 270 Gr Sabor Vanilla Ice Cream + Strawberry Lime"
"Suplementos";"Proteinas";"Star Nutrition";"Proteina Whey Star Nutrition 2 Lb + Mtor 270 Gr Sabor Strawberry Cream + Watermelon"
"Suplementos";"Proteinas";"Star Nutrition";"Proteina Whey Star Nutrition 2 Lb + Mtor 270 Gr Sabor Strawberry Cream + Strawberry Lime"
"Suplementos";"Proteinas";"Star Nutrition";"Proteina Whey Star Nutrition 2 Lb + Mtor 270 Gr Sabor Strawberry Cream + Green Lemonade"
"Suplementos";"Proteinas";"Star Nutrition";"Proteina Whey Star Nutrition 2 Lb + Mtor 270 Gr Sabor Strawberry Cream + Grape Attack"
"Suplementos";"Proteinas";"Star Nutrition";"Proteina Whey Star Nutrition 2 Lb + Mtor 270 Gr Sabor Strawberry Cream + Blue Raz"
"Suplementos";"Proteinas";"Star Nutrition";"Proteina Whey Star Nutrition 2Lb Sabor Cookies & Cream + Mtor 270g"
"Suplementos";"Proteinas";"Star Nutrition";"Proteina Whey Star Nutrition 2 Lb + Mtor 270 Gr Sabor Chocolate Suizo + Blue Raz"
"Suplementos";"Proteinas";"Star Nutrition";"Proteina Whey Star Nutrition 2 Lb + Mtor 270 Gr Sabor Chocolate Suizo + Watermelon"
"Suplementos";"Proteinas";"Star Nutrition";"Proteina Whey Star Nutrition 2 Lb + Mtor 270 Gr Sabor Chocolate Suizo + Strawberry Lime"
"Suplementos";"Proteinas";"Star Nutrition";"Proteina Whey Star Nutrition 2LB Chocolate Suizo + Mtor Bcaa 270G"
"Suplementos";"Creatinas";"Star Nutrition";"Star Nutrition Whey Protein Sabor Banana 908g Creatina Monohidratada 300g Vaso Legend 600ml"
"Suplementos";"Accesorios";"Star Nutrition";"Bcaa 2000 X 120 Caps Star Nutrition Aminoácidos Ramificados Sabor Sin Sabor + Pastillero Legend"
"Suplementos";"Accesorios";"Star Nutrition";"Thermo Fuel Max 120 Caps Star Nutrition Quemador Termogénico En Frasco Sin Sabor + Pastillero Legend"
"Suplementos";"Accesorios";"Star Nutrition";"Thermo Fuel Max 120 Caps Star Nutrition Quemador Termogénico En Frasco Sin Sabor X2 + Pastillero Legend"
"Suplementos";"Accesorios";"Star Nutrition";"Hmb Star Nutrition 180 Cápsulas Sin Sabor + Pastillero Legend"
"Suplementos";"Accesorios";"Hoch Sport";"3 Testo High Hoch Sport Boost Natural Testosterone Premium 120 Cápsulas + Pastillero Legend"
"Suplementos";"Creatinas";"Optimum";"Suplemento En Polvo Optimum Nutrition Creatina Monohidratada 300g X2"
"Suplementos";"Vitaminas y Salud";"Star Nutrition";"Vitamina C Star Nutrition X3 Frascos 60 Cápsulas Sin Sabor | Refuerzo Inmune"
"Suplementos";"Accesorios";"Hoch Sport";"2 Testo High Hoch Sport Boost Natural 120 Cap Sabor Sin Sabor + Pastillero Legend"
"Suplementos";"Accesorios";"Eth Nutrition";"Eth Nad + Resveratrol 1500 Con K2 Y D3 Premium 30 Cápsulas + Pastillero Legend"
"Suplementos";"Vitaminas y Salud";"Star Nutrition";"Vitamina C Star Nutrition X2 Frascos 60 Cápsulas Sin Sabor | Refuerzo Inmune"
"Suplementos";"Combos";"Body Advance";"Zma 90 Comp Body Advance Magnesio Zinc Vitamina B6 Pack X2 Sin Sabor"
"Suplementos";"Combos";"Body Advance";"Zma 90 Comp Body Advance Magnesio Zinc Vitamina B6 Pack X3 Sin Sabor"
"Suplementos";"Combos";"Body Advance";"Creatina Monohidrato 150 Gr Body Advance Pack X4 Sabor Sin Sabor"
"Suplementos";"Combos";"Body Advance";"Creatina Monohidrato 150 Gr Body Advance Pack X3 Sabor Sin Sabor"
"Suplementos";"BCAA-Aminos";"Body Advance";"Glutamina Body Advance X 300 Gr Sabor Sin Sabor"
"Suplementos";"Creatinas";"Body Advance";"Suplemento En Polvo Body Advance Creatina Monohidrato 150g X2 + Vaso Legend Nutrition 600ml"
"Suplementos";"Vitaminas y Salud";"Body Advance";"Suplemento En Polvo Body Advance Vitamina C + Vitamina D + Zinc X2 240gr Sabor Naranja"
"Suplementos";"Vitaminas y Salud";"Body Advance";"Suplemento En Polvo Body Advance 3 Vitaminas C + Vitamina D + Zinc X 240gr Sabor Naranja"
"Suplementos";"BCAA-Aminos";"Body Advance";"L-carnitine X 120 Comprimidos Body Advance Quemador De Grasas Sin Sabor"
"Suplementos";"BCAA-Aminos";"Body Advance";"L-carnitine X 120 Comprimidos Body Advance X3 Quemador De Grasas Sin Sabor"
"Suplementos";"Proteinas";"Body Advance";"Suplemento En Polvo Body Advance Whey Protein 907g + Vaso Legend Nutrition 600ml"
"Suplementos";"Combos";"Body Advance";"Suplemento En Polvo Body Advance Whey Protein 907g Pack X2 + Vaso Legend Nutrition 600ml"
"Suplementos";"Creatinas";"Body Advance";"Body Advance Whey Protein 3kg + 2 Creatinas Monohidratadas 150gr + Vaso Legend 600ml"
"Suplementos";"Proteinas";"Body Advance";"Suplemento En Polvo Body Advance Whey Protein 3kg + Vaso Legend Nutrition 600ml"
"Suplementos";"Creatinas";"Body Advance";"Body Advance Whey Protein 907g + Creatina Monohidratada 150g + Vaso Legend 600ml"
"Suplementos";"Accesorios";"Star Nutrition";"Vitamina C 60 Cápsulas Star Nutrition Sin Sabor X2 + Pastillero Legend"
"Suplementos";"Accesorios";"Star Nutrition";"Hmb Star Nutrition 180 Cápsulas Sin Sabor X2 + Pastillero Legend"
"Suplementos";"Accesorios";"Star Nutrition";"Multivitamin All In One X60 Caps - Star Nutrition Sabor Sin Sabor + Pastillero Legend"
"Suplementos";"BCAA-Aminos";"Bsn";"Suplemento Bsn Aminox 435g Con Bcaa En Polvo + Vaso Legend 600ml"
