"Vertical";"SubTipo";"Marca";"Nombre"
"Supermercado";"Otros alimentos";"Dicomere";"Dicomere Harina De Trigo Sarraceno Sin Tacc 450gr"
"Supermercado";"Almacén";"Dicomere";"Sal Marina Finas Hierbas Ahumadas Sin Tacc X 450gr Dicomere"
"Supermercado";"Almacén";"Dicomere";"Sal Baja En Sodio Sin Tacc (salero) X 70gr Dicomere"
"Supermercado";"Otros alimentos";"Dicomere";"Rebozador De Arroz Dicomere Sin Tacc Freir Y Hornear 450g"
"Supermercado";"Almacén";"Dicomere";"Premezcla Universal C/ Psyillum Husk Dicomere 450 G"
"Supermercado";"Otros alimentos";"Dicomere";"Premezcla Para Pizza Sin Tacc Dicomere 450 Gr"
"Hogar";"Otros hogar";"Jesper";"Azúcar Rubio Mascabo Jesper X 500gr"
"Hogar";"Otros hogar";"Jesper";"Té Rojo Jesper En Saquitos X 25 Unidades Sin Tacc"
"Hogar";"Otros hogar";"Jesper";"Té Verde Jesper En Saquitos X 25 Unidades Sin Tacc"
"Hogar";"Otros hogar";"Jesper";"Yerba Mate Con Té Verde Jesper X 500gr Sin Tacc"
"Hogar";"Otros hogar";"Jesper";"Yerba Mate Con Hierbas Serranas Jesper X 500gr Sin Tacc"
"Hogar";"Otros hogar";"Jesper";"Yerba Mate Tradicional Jesper X 500gr Sin Tacc"
"Suplementos";"Vitaminas y Salud";"Eth Nutrition";"Eth Nad 1000 + Resveratrol Suplemento 3 Potes X 30 Cápsulas"
"Suplementos";"Vitaminas y Salud";"Eth Nutrition";"Eth Nutrition Magnesium Óxido De Magnesio 2 Unidades X 60 Cápsulas"
"Suplementos";"Vitaminas y Salud";"Eth Nutrition";"Eth Nutrition Magnesium Óxido De Magnesio 3 Unidades X 60 Cápsulas"
"Suplementos";"Vitaminas y Salud";"Eth Nutrition";"Eth Nutrition Vitamina C Concentrada 2 Potes X 30 Cápsulas"
"Suplementos";"Vitaminas y Salud";"Eth Nutrition";"Eth Nutrition Vitamina C Concentrada 3 Potes X 30 Cápsulas"
"Suplementos";"Otros";"Eth Nutrition";"Pastillas Para La Caída Del Cábelo Innerx Grow Eth Nutrition 2 Potes X 30 Unidades"
"Suplementos";"Otros";"Eth Nutrition";"Pastillas Para La Caída Del Cábelo Innerx Grow Eth Nutrition 3 Potes X 30 Unidades"
"Suplementos";"Vitaminas y Salud";"Eth Nutrition";"Eth Nad + Resveratrol 1500 Con K2 Y D3 Premium 2 Potes X 30 Cápsulas"
"Suplementos";"Otros";"Eth Nutrition";"3 Potes X 30 Pastillas Inferno Para Adelgazar Rápido Quema Grasa Eth Nutrition"
"Suplementos";"Otros";"Eth Nutrition";"2 Potes X 30 Pastillas Inferno Para Adelgazar Rápido Quema Grasa Eth Nutrition"
"Suplementos";"Vitaminas y Salud";"Eth Nutrition";"Eth Nad 1000 + Resveratrol Suplemento 2 Potes X 30 Cápsulas"
"Suplementos";"Proteinas";"Bigual";"6 Barras 50g Bigual Con 19g De Proteína Original Con Chips"
"Suplementos";"Proteinas";"Bigual";"6 Barras 50g Bigual Con 18g De Proteína Sabor Café Sin Tacc"
"Suplementos";"Proteinas";"Bigual";"6 Barras 50g Bigual Con 18g De Proteína Sabor Cacao Amargo Sin Tacc"
"Suplementos";"Proteinas";"Bigual";"Pack 12 Barras 50g Con 18g Proteinas Cacao Amargo Sin Tacc"
"Suplementos";"Proteinas";"Bigual";"Pack 12 Barras 50g Bigual Con 18g Proteinas Cafe Sin Tacc"
"Suplementos";"Proteinas";"Bigual";"Pack 12 Barras 50g Bigual Con 19g Proteinas Sin Tacc"
"Suplementos";"Proteinas";"Bigual";"Barra 50g Bigual Con Proteina 18g Sabor Café Sin Tacc"
"Suplementos";"Proteinas";"Bigual";"Barra 50g Barra Con Proteinas 19g Original Chips Sin Tacc"
"Suplementos";"Proteinas";"Bigual";"Barra 50g Bigual Con Proteinas 18g Cacao Amargo Sin Tacc"
"Supermercado";"Almacén";"Hgl-Organikal";"x10 Te Verde Matcha En Polvo Organikal Hgl 50gr"
"Supermercado";"Almacén";"Hgl-Organikal";"x5 Organikal Superfoods Te Verde Matcha"
"Supermercado";"Snacks";"Felfort";"Mentitas Felfort Bombones De Menta Al Chocolate 30u X 16 Gr."
"Supermercado";"Snacks";"Felfort";"Licoritas Al Chocolate Felfort Botellita Con Licor 25u X 20g"
"Supermercado";"Otros alimentos";"Felfort";"Kooky Bon Felfort Bocadito Relleno Marroc Bañado 30u X 10gr"
"Suplementos";"Vitaminas y Salud";"Eth Nutrition";"Eth Nad + Resveratrol 1500 Con K2 Y D3 Premium 30 Cápsulas"
"Suplementos";"Vitaminas y Salud";"Eth Nutrition";"Eth Nutrition Vitamina C Concentrada 30 Cápsulas Pote"
"Suplementos";"Vitaminas y Salud";"Eth Nutrition";"Eth Nutrition Magnesium Óxido De Magnesio 60 Cápsulas"
"Suplementos";"Otros";"Eth Nutrition";"Pastillas Para La Caída Del Cábelo Innerx Grow Eth Sabor Sin Sabor"
"Suplementos";"Otros";"Eth Nutrition";"Pastillas Para Adelgazar Rápido Quema Grasa Eth Inferno Sabor Sin Sabor"
"Suplementos";"Vitaminas y Salud";"Eth Nutrition";"Vitamina K2 + Vitamina D3 Suplemento Fortalecimiento Huesos Sin Sabor"
"Suplementos";"Creatinas";"Ena";"3 Creatina Micronizada 100% Pura X 300gr Sabor Fruit Punch Vaso Legend Nutrition"
"Suplementos";"Creatinas";"Ena";"3 Creatina Micronizada 100% Pura X 300gr Sabor Neutro Vaso Legend Nutrition"
"Suplementos";"Creatinas";"Ena";"2 Creatina Micronizada 100% Pura X 300gr Sabor Nuetro Vaso Legend Nutrition"
"Supermercado";"Snacks";"Entrenuts";"Pasta De Mani Mix Semillas Entrenuts S/tacc / Vegana X 370 G"
"Suplementos";"Vitaminas y Salud";"Eth Nutrition";"Eth Nad 1000 + Resveratrol Suplemento En Cápsulas X 30"
"Suplementos";"Vitaminas y Salud";"InnovaNaturals";"Innova Naturals Vitamina K2 + D3 4 Unidades X 30 Cápsulas"
"Suplementos";"Vitaminas y Salud";"InnovaNaturals";"Innova Naturals Vitamina K2 + D3 3 Unidades X 30 Cápsulas"
"Suplementos";"Vitaminas y Salud";"InnovaNaturals";"Innova Naturals Vitamina K2 + D3 2 Unidades X 30 Cápsulas"
"Suplementos";"Vitaminas y Salud";"InnovaNaturals";"Innova Naturals Multivitamínico 3 Unidades X 30 Cápsulas Aporta Vitalidad Y Energía"
"Suplementos";"Vitaminas y Salud";"InnovaNaturals";"Innova Naturals Multivitamínico 2 Unidades X 30 Cápsulas Aporta Vitalidad Y Energía"
"Suplementos";"Vitaminas y Salud";"InnovaNaturals";"Aceite De Krill Innova Naturals 4 Unidades X 60 Cápsulas Salud Cardiovascular"
"Suplementos";"Vitaminas y Salud";"InnovaNaturals";"Aceite De Krill Innova Naturals 3 Unidades X 60 Cápsulas Salud Cardiovascular"
"Suplementos";"Vitaminas y Salud";"InnovaNaturals";"Aceite De Krill Innova Naturals 2 Unidades X 60 Cápsulas Salud Cardiovascular"
"Suplementos";"Vitaminas y Salud";"InnovaNaturals";"Glicinato De Magnesio Innova Naturals 4 Unidades X 60 Cápsulas"
"Suplementos";"Vitaminas y Salud";"InnovaNaturals";"Glicinato De Magnesio Innova Naturals 3 Unidades X 60 Cápsulas"
"Suplementos";"Vitaminas y Salud";"InnovaNaturals";"Glicinato De Magnesio Innova Naturals 2 Unidades X 60 Cápsulas"
"Supermercado";"Snacks";"Felfort";"Figura Conejo De Chocolate Blanco De Pascua Felfort 80 Gr"
"Supermercado";"Snacks";"Felfort";"Figura Conejo De Chocolate Con Leche De Pascua Felfort 80 Gr"
"Supermercado";"Snacks";"Felfort";"Huevo De Chocolate Felfort 25 Unidades X 10g Huevo De Pascua"
"Supermercado";"Almacén";"Oleovares";"Oiiloleo Aceite De Oliva Bidón X 2lts"
"Supermercado";"Almacén";"Dicomere";"Golden Syrup Dicomere Jarabe Miel Caña 300gr Sin Tacc"
"Supermercado";"Almacén";"120 años";"Aceite De Oliva Extra Virgen 250ml 120años Productos Gourmet"
"Supermercado";"Almacén";"120 años";"Aceite De Olive Extra Virgen 500ml 120años Productos Gourmet"
"Supermercado";"Otros alimentos";"120 años";"Aceto Balsámico 500 Ml 120 Años Productos Gourmet"
"Supermercado";"Bebidas";"120 Años";"Jugo De Limón 1 Litro 120 Años Productos Gourmet"
"Hogar";"Otros hogar";"Imperial";"Cerveza Roja Lata Imperial 473ml"
"Hogar";"Otros hogar";"Imperial";"Cerveza Rubia Lata Imperial 710ml"
"Supermercado";"Bebidas alcohólicas";"Elementos";"Vino Elementos Malbec 750ml"
"Bodega";"Bodega";"Quilmes";"Cerveza Rubia Lata Quilmes 710ml Clásica Original"
"Bodega";"Bodega";"Corona";"Cerveza Corona Rubia Botella 710ml"
"Bodega";"Bodega";"Red Bull";"Red Bull Energy Drink Lata X 250ml Bebida Energizante"
"Suplementos";"BCAA-Aminos";"Gold Nutrition";"Bcaa 2000 - Gold Nutrition - Aminoácidos Ramificados 120 Tab Sabor Sin Sabor"
"Suplementos";"Vitaminas y Salud";"InnovaNaturals";"Innovanaturals Omega 3 Cápsulas Blandas - Pack De 3 Frascos De 60 U"
"Suplementos";"Vitaminas y Salud";"Star Nutrition";"Star Nutrition Resveratrol 500 Antioxidante 60 Capsulas X2 U Sabor Neutro"
"Suplementos";"Vitaminas y Salud";"Vitamin Way";"Colágeno Beauty Vitamin Way Nutrition X 120gr Sabor Limón"
"Suplementos";"Vitaminas y Salud";"Star Nutrition";"Suplemento En Polvo 3 Resveratrol 500 Star Nutrition 60 Capsulas Antioxidante Sin Sabor"
"Bodega";"Bodega";"Fond de Cave";"Botella De Vino Tinto Fond De Cave Syrah 750ml"
"Bodega";"Bodega";"La Celia";"Vino La Celia Reserva Malbec Tinto 750ml"
"Supermercado";"Bebidas alcohólicas";"Federico Alvear";"Espumante Champagne Federico Alvear Extra Brut 750cc"
"Hogar";"Limpieza hogar";"Raid";"Raid Tabletas Para Mosquito Y Zancudos X 24 Unidades"
"Supermercado";"Almacén";"Hileret";"Edulcorante Hileret Stevia 50 Sobres"
"Hogar";"Limpieza hogar";"Cif";"Limpiador Cremoso Multiuso Original Cif 375 G - 250 Ml"
"Hogar";"Limpieza hogar";"Cif";"Desengrasante En Crema Cif Multiuso Rosa Y Jazmin X375g"
"Suplementos";"Vitaminas y Salud";"InnovaNaturals";"Glicinato De Magnesio Innovanaturals X60 Caps."
"Suplementos";"Vitaminas y Salud";"InnovaNaturals";"Innovanaturals Citrato De Magnesio X 60 Cápsulas Sabor Sin Sabor"
"Suplementos";"Vitaminas y Salud";"InnovaNaturals";"Vitamina K2+D3 X30caps Innovanaturals Sabor Sin Sabor"
"Suplementos";"Vitaminas y Salud";"InnovaNaturals";"Innovanaturals Multivitamínico Aporta Vitalidad Y Energía 30 Cápsulas"
"Suplementos";"Vitaminas y Salud";"InnovaNaturals";"Innovanaturals Aceite De Krill 60 Cápsulas Salud Cardiovascular Sin Sabor"
"Suplementos";"Vitaminas y Salud";"InnovaNaturals";"Suplemento En Cápsulas Blandas Innovanaturals Omega 3 X 60g"
"Suplementos";"Vitaminas y Salud";"InnovaNaturals";"Omega 3 Max 1000 Epa + 500 Dha Innovanaturals 60caps Ifos Goed"
"Suplementos";"Proteinas";"My Protein";"My Protein x12 Barras Layered Bar Crumble 60g"
"Suplementos";"Proteinas";"My Protein";"My Protein x12 Barras Impactbar Sabor Fudge Brownie Flavour 60g"
"Suplementos";"Proteinas";"My Protein";"Suplemento Vitaminas My Protein Daily Multivitamínico 60comp"
"Suplementos";"Proteinas";"My Protein";"Suplemento My Protein Beauty Coco + Colágeno 60 Cápsulas"
"Suplementos";"Proteinas";"My Protein";"Suplemento My Protein Aminoácidos Impact Bcaa 2:1:1 250 Gr"
"Suplementos";"Proteinas";"My Protein";"My Protein Clear Whey Protein Peach 500g"
"Suplementos";"Proteinas";"My Protein";"My Protein Pre-Entreno Sabor Naranja Mango en Pote de 465g"
"Suplementos";"Proteinas";"My Protein";"Proteína My Protein Impact Whey Protein en Doypack de 1 Kg"
"Suplementos";"Creatinas";"My Protein";"My Protein Impact Creatina Monohidratada 250gr"
"Suplementos";"Proteinas";"My Protein";"My Protein Colágeno Beauty Collagen 165 Gr"
"Suplementos";"Proteinas";"My Protein";"My Protein Collagen Powder Colágeno Hidrolizado 600gr"
"Suplementos";"Proteinas";"Optimum";"Proteína My Protein Impact Whey Isolada en Doypack 1 Kg"
"Suplementos";"Vitaminas y Salud";"Natural Whey";"Inositol Puro Vitamina B-h 50 Gr"
"Suplementos";"Combos";"Nutrilab";"Combo x2 Premium Whey Pro Nutrilab Proteina De Suero en Pote de 1KG"
"Suplementos";"Combos";"Nutrilab";"Creatina Nutrilab Crea Shock 300 Grs Pack X2 Fuerza y Volumen"
"Suplementos";"Otros";"Nutrilab";"Suplemento Nutrilab Live Fem 240 Comprimidos"
"Suplementos";"Vitaminas y Salud";"Nutrilab";"Suplemento Nutrilab Multi100 Multivitamínico 240 Comprimidos"
"Suplementos";"Pre-entrenos";"Nutrilab";"Suplemento Nutrilab Preworkout 300g Pre-entreno Energia y Concentración"
"Suplementos";"Creatinas";"Nutrilab";"Suplemento Nutrilab Creatina Monohidrato Ready 300 Gr"
"Suplementos";"Otros";"Nutrilab";"Suplemento Nutrilab Mass Builder en Pote de 1,6 Kg"
"Suplementos";"Proteinas";"Nutrilab";"Suplemento Nutrilab Whey Protein en Pote de 1kg"
"Suplementos";"Combos";"Star Nutrition";"Star Nutrition Combo Creatina Monohidrato Micronizada 1 Kg. X2 Unidades"
"Suplementos";"Saborizantes";"Main Fusion";"MAINFUSION Combo 2 Jarabe Syrup de 1 Litro + Dosificador"
"Suplementos";"Saborizantes";"Main Fusion";"MAINFUSION Combo 1 Jarabe Syrup de 1 Litro + Dosificador"
"Bodega";"Bodega";"Ambos";"Pack x12 Zaleas Ambos de 10 Unidades Protector Descartable"
"Bodega";"Bodega";"Ambos";"Pack x6 Zaleas Ambos de 10 Unidades Protector Descartable"
"Suplementos";"Saborizantes";"Main Fusion";"MAINFUSION Dosificador Syrups Jarabe"
"Suplementos";"Vitaminas y Salud";"Vitamin Way";"Vitamin Way Isoflavonas Ayuda A Disminuir Efectos Menopausia Sabor Neutro"
"Suplementos";"Accesorios";"Natural Whey";"Suplemento En Polvo Natural Whey Antiage Colágeno X 1kg + Shaker Legend"
"Suplementos";"Creatinas";"Optimum";"2 On Optimum Nutrition Creatina Micronizada Suplemento En Polvo Pote 300g Vaso Legend Nutrition 600ml"
"Supermercado";"Cuidado personal";"SriSri";"Sri Sri Tattva Crema Para Pies 100g"
"Suplementos";"Vitaminas y Salud";"Breaking Lab";"Citrato De Magnesio Breaking Lab 500gr"
"Suplementos";"Vitaminas y Salud";"Breaking Lab";"Vitamina C Breaking Lab Ácido Ascórbico 1kg En Polvo"
"Suplementos";"Creatinas";"Optimum";"Suplemento Proteína Optimum 1.5 Lb + Creatina Micronizada 300g + Vaso Legend 600ml"
"Bananero";"El Bananero";"Japi";"Remera Sape Y Cerveza Japi Amber Roja Pack 12 Unidades El Bananero"
"Bananero";"El Bananero";"Japi";"Remera Comic Cerveza Japi Amber Roja Pack 12 Unidades El Bananero"
"Bananero";"El Bananero";"Japi";"Pack Cerveza Japi Porter Negra X 12 El Bananero"
"Bananero";"El Bananero";"Japi";"Pack Cerveza Japi Amber Roja X 12 El Bananero"
"Bananero";"El Bananero";"Japi";"Pack X6 Cerveza Japi Amber Roja El Bananero 473ml"
"Bananero";"El Bananero";"Japi";"Pack X6 Cerveza Japi Porter Negra El Bananero 473ml"
"Bananero";"El Bananero";"Japi";"Cerveza Japi Premium Porter Negra El Bananero Lata 473ml"
"Bananero";"El Bananero";"Japi";"Cerveza Japi Premium Amber Roja El Bananero Nueva Lata 473ml"
"Suplementos";"Otros";"Main Fusion";"MAINFUSION Chocolatada Instantánea 1,15kg"
"Suplementos";"Combos";"Star Nutrition";"Combo Star Nutrition 1 Doypack Whey Protein 2lb + 1 Creatina 300gr + 1 BCAA 270gr Green Limonade"
"Suplementos";"Combos";"Star Nutrition";"Combo Star Nutrition 1 Doypack Whey Protein 2lb + 1 Creatina 300gr + 1 BCAA 270gr Watermelon"
"Suplementos";"Combos";"Star Nutrition";"Combo Star Nutrition 1 Doypack Whey Protein 2lb + 1 Creatina 300gr + 1 BCAA 270gr Strawberry"
"Supermercado";"Snacks";"Entrenuts";"Pack x3 Pasta De Mani Natural Entrenuts Balde 4kg Sin Tacc Vegano"
"Supermercado";"Almacén";"Entrenuts";"Combo x3 Aceite De Coco Neutro X 200 Cc - Entrenuts"
"Supermercado";"Almacén";"Entrenuts";"Combo x3 Aceite De Coco Virgen Entrenuts Sin Tacc / Vegano X 200 Cc"
"Supermercado";"Almacén";"Entrenuts";"Combo x3 Miel Liquida Entrenuts Sin Tacc Kosher 500g"
"Supermercado";"Almacén";"Entrenuts";"Combo x3 Entrenuts Aceite De Coco Virgen Sin Tacc 360 Cc"
"Supermercado";"Almacén";"Entrenuts";"Combo x3 Miel Cremosa Entrenuts Sin Tacc Kosher 500g"
"Supermercado";"Otros alimentos";"Entrenuts";"Combo x3 Ghee Manteca Clarificada Entrenuts 300g Sin Tacc"
"Supermercado";"Almacén";"Entrenuts";"Combo x3 Pasta Maní Entrenuts Stevia X 370gr Sin Gluten Sin Tacc"
"Supermercado";"Snacks";"Entrenuts";"Combo x3 Pasta Maní Entrenuts Ahumada X 370gr Sin Gluten Sin Tacc"
"Supermercado";"Almacén";"Entrenuts";"Combo x3 Pasta Maní Entrenuts Sabor Cacao X 370gr Sin Gluten Sin Tacc"
"Supermercado";"Snacks";"Entrenuts";"Combo x3 Pasta Maní Entrenuts Sabor Coco X 370gr Sin Gluten Sin Tacc"
"Supermercado";"Snacks";"Entrenuts";"Combo x3 Pasta Maní Entrenuts Natural X 370gr Sin Gluten Sin Tacc"
"Supermercado";"Snacks";"Entrenuts";"Combo x3 Pasta Maní Entrenuts Crocante X 370gr Sin Gluten Sin Tacc"
"Supermercado";"Almacén";"Entrenuts";"Combo x3 Aceite De Coco Neutro 100% Puro 360cc Entrenuts Sin Tacc"
"Hogar";"Limpieza hogar";"Ayudin";"Pack 15 Lavandinas Ayudin 1 Litro. Oferta!!"
"Suplementos";"Creatinas";"Body Advance";"Suplemento En Polvo Body Advance Whey Protein 3kg + 2 Creatinas 150gr"
"Suplementos";"Creatinas";"Body Advance";"Suplemento En Polvo Body Advance Whey Protein 910gr + Creatina 150gr"
"Suplementos";"Vitaminas y Salud";"Star Nutrition";"Citrato De Magnesio En Polvo 500g Star Nutrition"
"Suplementos";"Vitaminas y Salud";"Star Nutrition";"Collagen Plus 360gr En Polvo Sabor Limón - Star Nutrition"
"Suplementos";"Vitaminas y Salud";"Star Nutrition";"Collagen Sport 360 G En Polvo Sabor Naranja - Star Nutrition"
"Suplementos";"Proteinas";"Star Nutrition";"Proteina Platinum Whey Protein 3kg Star Nutrition"
"Suplementos";"Accesorios";"Hoch Sport";"Suplemento Hochsport Creatina Profesional Series De 300g + Shaker Legend Nutrition"
"Suplementos";"Accesorios";"Hoch Sport";"Whey Protein 3 Kg Hoch Sport Mango Citric + Vaso Shaker Antigrumos Legend"
"Suplementos";"Accesorios";"Hoch Sport";"Suplemento En Polvo Nucleo Fit Whey Protein En Pote De 1 Kg + Shaker Legend 600ml"
"Supermercado";"Snacks";"Entrenuts";"Pasta Maní Entrenuts Crocante X 370gr Sin Gluten Sin Tacc"
"Supermercado";"Almacén";"Entrenuts";"Miel Cremosa Entrenuts Sin Tacc Kosher 500g"
"Supermercado";"Otros alimentos";"Entrenuts";"Ghee Manteca Clarificada Entrenuts 300g Sin Tacc"
"Supermercado";"Almacén";"Entrenuts";"Entrenuts Aceite De Coco Virgen Sin Tacc 360 Cc"
"Supermercado";"Almacén";"Entrenuts";"Aceite De Coco Virgen Entrenuts Sin Tacc / Vegano X 200 Cc"
"Supermercado";"Almacén";"Entrenuts";"Aceite De Coco Neutro X 200 Cc - Entrenuts"
"Supermercado";"Almacén";"Entrenuts";"Aceite De Coco Neutro 100% Puro 360cc Entrenuts Sin Tacc"
"Supermercado";"Snacks";"Entrenuts";"Pasta Maní Entrenuts Natural X 370gr Sin Gluten Sin Tacc"
"Supermercado";"Snacks";"Entrenuts";"Pasta Maní Entrenuts Ahumada X 370gr Sin Gluten Sin Tacc"
"Supermercado";"Snacks";"Entrenuts";"Pasta Maní Entrenuts Sabor Coco X 370gr Sin Gluten Sin Tacc"
"Supermercado";"Almacén";"Entrenuts";"Pasta Maní Entrenuts Sabor Cacao X 370gr Sin Gluten Sin Tacc"
"Supermercado";"Almacén";"Entrenuts";"Pasta Maní Entrenuts Stevia X 370gr Sin Gluten Sin Tacc"
"Supermercado";"Snacks";"Entrenuts";"Mani Tostado Entrenuts 100g Snack Sin Tacc"
"Supermercado";"Almacén";"Entrenuts";"Miel Liquida Entrenuts Sin Tacc Kosher 500g"
"Hogar";"Otros hogar";"Futura";"Bicicleta Mountain Bike Futura Techno 026 Fs R26 18 21v Color Azul Tamaño Del Cuadro 18"
"Hogar";"Otros hogar";"Triton";"Mingitorio Inteligente Modelo Slim Triton"
"Hogar";"Otros hogar";"Triton";"Mingitorio Inteligente Modelo Curve Triton"
"Hogar";"Otros hogar";"Triton";"Ducha Inteligente Hydro Smart Triton"
"Hogar";"Otros hogar";"Triton";"Toallero Electrico Smart Heat Bar Triton"
"Hogar";"Otros hogar";"Triton";"Secador De Manos Inteligente Aerolux Ultra Rapido Triton"
"Hogar";"Otros hogar";"Triton";"Griferia Inteligente Cuello Flexible Aqua Sense Triton"
"Hogar";"Otros hogar";"Triton";"Bacha Lavatorio Triton Totem"
"Hogar";"Otros hogar";"Triton";"Griferia Monocomando Pico Alto Altus Triton"
"Hogar";"Otros hogar";"Triton";"Essensia Bacha Inteligente De Acero Inoxidable Triton Negro"
"Hogar";"Otros hogar";"Triton";"Inodoro Baño Bidet Inteligente Triton Aerial Smart"
"Hogar";"Otros hogar";"Triton";"Inodoro Baño Bidet Inteligente Triton Royal Smart"
"Hogar";"Otros hogar";"Triton";"Inodoro Baño Bidet Inteligente Triton Total White Smart"
"Hogar";"Otros hogar";"Triton";"Inodoro Baño Bidet Inteligente Triton Total Black Smart"
"Hogar";"Otros hogar";"Triton";"Bacha Lavatorio Triton Roda Black"
"Hogar";"Otros hogar";"Triton";"Bacha Lavatorio Triton Roda Gold"
"Hogar";"Otros hogar";"Triton";"Bacha Lavatorio Triton Mare"
"Hogar";"Otros hogar";"Triton";"Bacha Lavatorio Triton Aqua"
"Hogar";"Otros hogar";"Triton";"Bacha Lavatorio Triton Terra"
"Hogar";"Otros hogar";"Triton";"Bacha Lavatorio Triton Stadium"
"Hogar";"Otros hogar";"Triton";"Bacha Lavatorio Triton Zepellin"
"Hogar";"Otros hogar";"Triton";"Bacha Lavatorios Triton Triangle"
"Hogar";"Otros hogar";"Triton";"Bacha Lavatorio Triton Luna"
"Hogar";"Otros hogar";"Triton";"Bacha Lavatorio Triton Roda Baño Blanco"
"Hogar";"Otros hogar";"Triton";"Inodoro Baño Bidet Inteligente Triton Q9 Smart Temperatura"
"Hogar";"Limpieza hogar";"Ayudin";"Lavandina Ayudín Clásica Agua Lavandina Común 1 Litro 50 OFF!!"
"Supermercado";"Snacks";"Entrenuts";"Pasta De Mani Natural Entrenuts Balde 4kg Sin Tacc Vegano"
"Suplementos";"Proteinas";"Universal Nutrition";"Protein Isolate Loaded Whey Sabor Vainilla 4 Lb- Animal"
"Suplementos";"Creatinas";"Universal Nutrition";"Creatine Monohydrate 100% Pure 500 Gramos - Animal"
"Suplementos";"Otros";"Pgn";"Pharmahepat X 70ml Laboratorio Pgn Sabor Sin Sabor"
"Suplementos";"Vitaminas y Salud";"Pgn";"Suplemento Polvo Colageno Solar Colageno Betacarotero 300gr"
"Suplementos";"Vitaminas y Salud";"Pgn";"Suplemento Colageno Solar Colageno Betacarotero 30 Capsulas"
"Suplementos";"Combos";"Pgn";"Colágeno + Magnesio Pgn X 60 Capsulas Pack X2"
"Suplementos";"Combos";"Pgn";"Sedanat Pgn X 30 Capsulas Sedante Natural Insomnio - Pack X2"
"Suplementos";"Combos";"Pgn";"Colágeno + Magnesio Pgn 60 Capsulas Pack X4"
"Suplementos";"Combos";"Pgn";"Lisin C Pgn X 100 Capsulas Vitamina C Y Lisina - Pack X2"
"Suplementos";"Combos";"Pgn";"Cúrcuma & Pimienta Negra 100 Cápsulas Laboratorio Pgn Pack X4"
"Suplementos";"Combos";"Pgn";"Espirulina X 100 Capsulas Antioxidante Pgn Pack X2"
"Suplementos";"Combos";"Pgn";"Redumax Forte X 100 Cápsulas Adelgazante Natural Pgn Pack X2"
"Suplementos";"Combos";"Leguilab";"Brain Focus | 60cap Cafeína Vitamina B6 | L-teanina | Pack X4"
"Suplementos";"Combos";"Garden House";"Suplemento En Comprimidos Garden House Colágeno Hidrolizado En Caja 120 Un Pack X2"
"Suplementos";"Combos";"Garden House";"Garden House Suplemento Dietario Ginkgo 80mg 30comp Pack X3"
"Suplementos";"Creatinas";"Hoch Sport";"Nucleo Fit Whey Protein 1kg Chocolate Creatina Monohidratada 300g Colágeno Hidrolizado 200g"
"Suplementos";"Proteinas";"Hoch Sport";"Suplemento en Polvo Nucleo Fit Whey Protein en Pote de 1 Kg"
"Suplementos";"Proteinas";"Hoch Sport";"Barras Proteicas Nucleo Bar Protein Nucleo Fit X12 Unidades"
"Suplementos";"Pre-entrenos";"Nucleo Fit";"Pre Work Ripped 60 Caps Nucleo Fit Pre Entreno + Quemador"
"Suplementos";"Proteinas";"Hoch Sport";"Vegetal Protein Isolate 375 G Núcleo Fit Arvejas Arroz Soja"
"Suplementos";"Proteinas";"Nucleo Fit";"Colágeno Hidrolizado Fit Puro - 200g Núcleo Fit"
"Suplementos";"Vitaminas y Salud";"Hoch Sport";"Zma B Hoch Sport A Aspartato Magnesio + Zinc + Boro"
"Suplementos";"Quemadores";"Hoch Sport";"Thermogenix Con Cafeina Premium Hoch Sport X 120 Capsulas Sabor Sin Sabor"
"Suplementos";"Creatinas";"Hoch Sport";"Creatine Cell S.3 Crecimiento Muscular Y Recuperación Sabor Frutos Rojos"
"Suplementos";"Proteinas";"Hoch Sport";"Whey Protein X 1kg Hoch Sport"
"Suplementos";"Otros";"Hoch Sport";"Cafeina 200mg Hochsport Cafeine Plus 200 Energía 60 Cápsulas Sabor Sin Sabor"
"Suplementos";"Vitaminas y Salud";"Hoch Sport";"Multivitamínico Hochsport Multivitamin Complex 60 Cápsulas Sabor Sin Sabor"
"Suplementos";"Vitaminas y Salud";"Hoch Sport";"Vitamin B Complex X 90 Comp Hoch Sport B3 B6 B9 B12"
"Suplementos";"Otros";"Hoch Sport";"Beta Alanine Hoch Sport 75 Serv 225g Sin Sabor"
"Suplementos";"BCAA-Aminos";"Hoch Sport";"Bcaa 2200 Recuperacion Aminoacidos Resistencia - Hoch Sport Sabor Sin Sabor"
"Suplementos";"BCAA-Aminos";"Hoch Sport";"Arginina Powder X 210gs - Hoch Sport 100% Pure"
"Suplementos";"BCAA-Aminos";"Hoch Sport";"L Carnitina 1500 Hoch Sport X 60 Capsulas"
"Suplementos";"BCAA-Aminos";"Hoch Sport";"Glutamina Powder 200 Gr Hoch Sport Pura Micronizada"
"Suplementos";"Otros";"Body Advance";"Caffeine Anhydrous 200 X 90 Comp. - Body Advance - Cafeína Sabor Sin Sabor"
"Suplementos";"BCAA-Aminos";"Body Advance";"Bcaa Amino Powder 8:1:1 280 Gr Body Advance Vitamina B3"
"Suplementos";"Vitaminas y Salud";"Body Advance";"Vitamina C + Vitamina D + Zinc X 240g. Body Advance Sabor Naranja"
"Suplementos";"Vitaminas y Salud";"Body Advance";"Picolinato De Cromo X 90 Cap - Body Advance - Carbo Blocker Sabor Neutro"
"Suplementos";"Otros";"Leguilab";"Mct Oil Powder En Polvo Soluble 200g Libre De Gluten Sabor Sin Sabor"
"Suplementos";"Combos";"Leguilab";"Stress Killer | 60cap Magnesio Bisglicinato | L-teanina | Pack X4"
"Suplementos";"Combos";"Leguilab";"Happy Pill | 5htp 100mg X 60 Vcaps | Serotonina Triptofano | Pack X2"
"Suplementos";"Combos";"Leguilab";"Happy Pill | 5htp 100mg X 60 Vcaps. | Serotonina Triptofano Sabor Neutro | Pack X4"
"Suplementos";"Combos";"Leguilab";"Vitamina K2 (mk7) + Vitamina D3 Leguilab X2 X 60 Capsulas Sabor Neutro Pack X4"
"Suplementos";"Combos";"Leguilab";"Vitamina K2 (mk7) + Vitamina D3 Leguilab 60 Capsulas Sabor Neutro Pack X2"
"Suplementos";"Combos";"Leguilab";"L-teanina Cafeína Vitamina B6 Brain Focus Leguilab 60 Capsulas Pack X2"
"Suplementos";"Accesorios";"Star Nutrition";"Combo Star Nutrition Whey Protein 3 Kg + 2 Creatina X 300 Grs + Vaso Shaker Legend 600ml"
"Suplementos";"Combos";"Star Nutrition";"Combo Star Nutrition L Carnitina Quemador De Grasa 60 Caps. X3 Uni Sabor Neutro"
"Suplementos";"Combos";"Star Nutrition";"Combo Star Nutrition Pump 3d Ripped 315 Gr X 3 Uni - Pre Entreno Sabor Lemonade"
"Suplementos";"Combos";"Star Nutrition";"Combo Star Nutrition Glutamina Micronizada 300gr x3 Sin Sabor"
"Suplementos";"Combos";"Star Nutrition";"Combo Star Nutrition Creatina Monohidrato X 300 Gr + Glutamina 300 Sabor Neutro"
"Suplementos";"Combos";"Star Nutrition";"Combo Star Nutrition Quemador L Carnitina 1000 + Bcaa 2000 Sin Sabor"
"Suplementos";"Combos";"Star Nutrition";"Combo Star Nutrition Whey Protein 3 Kg + 2 Creatina X 300 Grs"
"Suplementos";"Combos";"Star Nutrition";"Combo Star Nutrition Zma x2 Zinc Magnesio Vitamina B6 90 Cap Sin Sabor"
"Suplementos";"Combos";"Star Nutrition";"Combo Star Nutrition All-in-one Multivitamínico - 60 Caps. X 3 Uni Sabor Sin Sabor"
"Suplementos";"Combos";"Star Nutrition";"Combo Star Nutrition Suplemento En Polvo Whey Protein 908g x2"
"Suplementos";"Combos";"Star Nutrition";"Combo Star Nutrition Whey Protein 2 Lb en Pote + Creatina 300 Gr"
