"Vertical";"SubTipo";"Marca";"Nombre"
"Supermercado";"Otros alimentos";"Every Day Nature";"Bicarbonato De Sodio Every Day Nature 1 Kg Edn Nutrition"
"Suplementos";"Accesorios";"Hoch Sport";"Combo 1 Whey Protein 1 Kg Nucleo Fit 1 Creatina 1 Shaker"
"Suplementos";"Accesorios";"Hoch Sport";"Combo X3 Whey Protein Nucleo Fit 1kg En Polvo Y Vaso Shaker"
"Suplementos";"Accesorios";"Hoch Sport";"Combo X2 Whey Protein Nucleo Fit 1kg En Polvo Y Vaso Shaker"
"Suplementos";"Quemadores";"Nutrex Research";"Lipo 6 Cla Nutrex 90 Caps Definicion Quemador De Grasa"
"Suplementos";"Vitaminas y Salud";"Vitamin Way";"Vitamin Way Acido Hialuronico Caja De 30 Capsulas"
"Suplementos";"Vitaminas y Salud";"Vitamin Way";"Bronsol Facilita Bronceado Vitamin Way - 30 Capsulas"
"Suplementos";"Combos";"Star Nutrition";"Combo Star Nutrition Creatina Doypack De 300g x2 unidades"
"Suplementos";"Combos";"Star Nutrition";"Combo Star Nutrition - Mutant Mass 5kg X2 unidades"
"Suplementos";"Combos";"Star Nutrition";"Combo Star Nutrition Mutant Mass 1,5kg X2 U + Creatina 300 Gr X2 U"
"Suplementos";"Combos";"Star Nutrition";"Combo Star Nutrition Mutant Mass 5kg + Creatina 300gr"
"Suplementos";"Otros";"Main Fusion";"MAINFUSION X2 Salsa Dulce De Leche y Chocolate Amargo 1,15kg + Bomba Dosificadora"
"Suplementos";"Otros";"Main Fusion";"MAINFUSION Bomba Dosificadora Salsa De Chocolate 1,15kg"
"Suplementos";"Otros";"Main Fusion";"MAINFUSION Bomba Dosificadora Salsa De Dulce De Leche 1,15kg"
"Supermercado";"Otros alimentos";"Every Day Nature";"Suplemento Every Day Nature 1kg Citrato De Magnesio Vitamina C En Polvo"
"Supermercado";"Otros alimentos";"Every Day Nature";"Suplemento Every Day Nature 1kg Citrato De Potasio Citrato De Magnesio En Polvo"
"Supermercado";"Otros alimentos";"Every Day Nature";"Suplemento Every Day Nature 1kg Vitamina C 1kg Colágeno Hidrolizado 1kg En Polvo"
"Supermercado";"Otros alimentos";"Every Day Nature";"Suplemento Every Day Nature 1kg Citrato De Potasio 1kg Vitamina C En Polvo"
"Supermercado";"Otros alimentos";"Every Day Nature";"Suplemento En Polvo Every Day Nature Citrato De Potasio 1kg Pack X2"
"Suplementos";"Otros";"Main Fusion";"MAINFUSION Bomba Dosificadora Salsas Negra P/grip 15ml"
"Suplementos";"Otros";"Main Fusion";"Mainfusion Puré Premium - 1 Litro"
"Suplementos";"Otros";"Main Fusion";"MAINFUSION Salsa Chocolate Semiamargo 1.15kg"
"Suplementos";"Otros";"Main Fusion";"MAINFUSION Salsa De Dulce De Leche 1,15 Kg"
"Suplementos";"Proteinas";"Ena";"Suplemento En Polvo Ena Sport Whey X-pro Proteína En Pote De 907g"
"Suplementos";"Otros";"Breaking Lab";"Ácido Málico Puro Importado 1kg"
"Supermercado";"Otros alimentos";"Every Day Nature";"Suplemento Every Day Nature Citrato De Potasio 1kg Vaso Legend 600ml"
"Hogar";"Otros hogar";"Elegante";"Papel Higiénico Elegante Premium Hoja Simple 80 m De 4 u"
"Suplementos";"Combos";"Star Nutrition";"Combo Star Nutrition Whey Protein Doypack 2 Lb X 3 Unidades"
"Suplementos";"Accesorios";"Protein Project";"Protein Project Collagen Peptides 908 Gr Colageno Sabor Limón + Vaso Shaker Legend"
"Suplementos";"Combos";"Vitamin Way";"Vitamin Way Vitamina C Con Zinc X 30 Capsulas Pack X2"
"Suplementos";"Combos";"Vitamin Way";"Vitamina D X 30 Capsulas Vitamin Way Pack X2"
"Suplementos";"Combos";"Vitamin Way";"Complejo Vitaminico Cabello, Piel Y Uñas En Capsulas Sabor Neutro Pack X3"
"Suplementos";"Combos";"Vitamin Way";"Vitamin Way Ginseng Guaraná Incrementa Energía Y Vitalidad Sabor Ginseng Rojo Coreano Pack X3"
"Suplementos";"Combos";"Hoch Sport";"Combo Hoch Sport 1 Whey Protein 3kg + x2 Creatina Micronizada 300gr + Vaso Legend"
"Suplementos";"Combos";"Hoch Sport";"Combo Hoch Sport Whey Protein 2kg + Creatina Micronizada 300gr + Vaso Legend 600ml"
"Suplementos";"Vitaminas y Salud";"Vitamin Way";"Probiotico + Prebiotico Vitamin Way X 30 Capsulas"
"Bananero";"El Bananero";"Japi";"Remera Comic Y Cerveza Japi Ipa Pack 12 Unidades El Bananero"
"Bananero";"El Bananero";"Japi";"Remera Comic Cerveza Japi Lager Pack 12 Unidades El Bananero"
"Bananero";"El Bananero";"Japi";"Remera Sape Y Cerveza Japi Lager Pack 12 Unidades El Bananero"
"Bananero";"El Bananero";"Japi";"Remera Sape Y Cerveza Japi Ipa Pack 12 Unidades El Bananero"
"Bananero";"El Bananero";"Japi";"Pack Cerveza Japi Lager Rubia X 12 El Bananero"
"Bananero";"El Bananero";"Japi";"Pack Cerveza Japi IPA X 12 El Bananero"
"Suplementos";"Accesorios";"Star Nutrition";"Colageno Hydrolizado X210 Gr. Suplemento Sabor Limón - Star Nutrition + Vaso Shaker Legend"
"Suplementos";"Accesorios";"Natural Whey";"Citrato De Magnesio 250 Grs Natural Whey Vaso Shaker Legend"
"Bananero";"El Bananero";"Japi";"Pack 6 Cervezas Japi Beer IPA El Bananero 473ml"
"Bananero";"El Bananero";"Japi";"Pack X6 Cerveza Japi Lager Rubia El Bananero 473ml"
"Bananero";"El Bananero";"Japi";"Remera Oficial El Bananero Japi Beer Universo Bananero!"
"Bananero";"El Bananero";"Japi";"Remera Oficial El Bananero Japi Beer Saaape!"
"Bananero";"El Bananero";"Japi";"Caja De Regalo Bananero Japi Beer 2 Lata Cerveza 1 Vaso"
"Bananero";"El Bananero";"Japi";"Cerveza Japi Premium IPA El Bananero Nueva Lata 473ml"
"Bananero";"El Bananero";"Japi";"Cerveza Japi Premium Lager Rubia El Bananero Nueva Lata 473ml"
"Suplementos";"Vitaminas y Salud";"Body Advance";"Testo Pro Max 240 Gr Body Advance Magnesio Vitamina B6 Zinc Sabor Wild Grapes"
"Suplementos";"Combos";"Vitamin Way";"Vitamin Way Ginkgo 120 Complex Memoria Atencion Pack X3"
"Supermercado";"Otros alimentos";"Every Day Nature";"Colageno Hidrolizado Peptidos X 1kg"
"Suplementos";"Vitaminas y Salud";"Hoch Sport";"Citrato De Magnesio Magnesium Citrato Hochsport Pote 60caps"
"Suplementos";"Vitaminas y Salud";"Mervick";"Sport Drink 1 Kg Mervick Lab Bebida Isotónica Sodio Potasio Magnesio Vitaminas Sabor Pomelo"
"Suplementos";"Pre-entrenos";"Star Nutrition";"N.o. Booster X 180 Capsulas - Oxido Nitrico Star Nutrition"
"Supermercado";"Snacks";"Choco Fit";"Alfajor De Arroz Choco Fit Bañado Chocolate Limon X54u"
"Supermercado";"Snacks";"Choco Fit";"Alfajor De Arroz Choco Fit Bañado Chocolate Blanco Ddl X54u"
"Supermercado";"Snacks";"Choco Fit";"Alfajor De Arroz Choco Fit Granel Bañado Chocolate Ddl X54u"
"Suplementos";"Vitaminas y Salud";"Star Nutrition";"Iron Pack Multivitamin - 44 Serv - 383 Gr - Star Nutrition Sabor Fruit Puch"
"Suplementos";"Pre-entrenos";"Star Nutrition";"Pump 3d Ripped 315g Star Nutrition Pre Entreno Sabor Strawberry Lime"
"Suplementos";"Otros";"Star Nutrition";"Just Carbs 1 Kg Star Nutrition Energia Y Resistencia Sabor Neutro"
"Suplementos";"Otros";"Star Nutrition";"Beta Alanine 100 % Pure X 300 Grs - Star Nutrition Sabor Sin Sabor"
"Suplementos";"Vitaminas y Salud";"Gold Nutrition";"Gold Nutrition Electrolytes 60caps Sales Minerales Vitaminas Sabor Sin Sabor"
"Supermercado";"Almacén";"Ki-bar";"Ki-bar Barrita Proteica Natural Sabor Cacao 1 Unidade De 40 G"
"Supermercado";"Almacén";"Ki-Bar";"Ki Bar Barrita Proteica Cafe Y Leche De Coco + 3 Claras 40g"
"Supermercado";"Snacks";"ki-bar";"Ki Bar Barra Proteica Manzana Datiles Mani + 3 Claras 40g"
"Supermercado";"Snacks";"ki-bar";"Ki Bar Barrita Proteica Vainilla Datiles Mani + 3 Claras 40g"
"Supermercado";"Otros alimentos";"ki-bar";"Barras Proteicas Naturales Ki-bar Sabor Coco 80gr"
"Supermercado";"Snacks";"cookies fit";"Galletitas De Arroz Cookies Fit Sabor Chocolate Blanco"
"Supermercado";"Almacén";"Cookies Fit";"Galletitas De Arroz Cookies Fit Sabor Chocolate Negro"
"Suplementos";"Vitaminas y Salud";"Garden House";"Garden House Suplemento Dietario Aceite De Pescado X 60 Un Sabor Sin Sabor"
"Supermercado";"Almacén";"Dicomere";"Sal Marina Carne Roja Ahumada Sin Tacc Dicomere X 450 Gr"
"Supermercado";"Almacén";"Dicomere";"Sal Marina Gruesa 100% Natural Sin Tacc Dicomere X 450 Grs"
"Supermercado";"Otros alimentos";"Dicomere";"Polvo Para Hornear (sin Tacc) Dicomere X 250g"
"Supermercado";"Otros alimentos";"Dicomere";"Harina De Garbanzo Orgánico Dicomere 450 G"
"Supermercado";"Otros alimentos";"Dicomere";"Fecula De Mandioca Sin Tacc X450gr Dicomere"
"Supermercado";"Otros alimentos";"Dicomere";"Harina De Sorgo Blanco Integral Dicomere 450g"
"Supermercado";"Almacén";"Dicomere";"Harina Algarroba Dicomere 200g = Cacao Sin Tacc Keto Vegano"
"Supermercado";"Otros alimentos";"Dicomere";"Leche De Coco En Polvo Dicomere 150g"
"Supermercado";"Otros alimentos";"Dicomere";"Polenta Organica Coccion Rapida Dicomere 450g"
"Supermercado";"Otros alimentos";"Dicomere";"Arveja Amarilla Texturizada (sin Tacc) Dicomere X 350g"
"Supermercado";"Otros alimentos";"Dicomere";"Fécula De Maíz Dicomere Libre De Gluten Sin Tacc 450g"
"Supermercado";"Otros alimentos";"Dicomere";"Harina De Arroz Integral Organico Dicomere Sin Tacc 450gr"
"Supermercado";"Otros alimentos";"Dicomere";"Dicomere Harina 200 G Almendra Unidad 1"
"Supermercado";"Otros alimentos";"Dicomere";"Garbanzo Texturizado Dicomere X 350 Gr Sin Tacc"
"Supermercado";"Otros alimentos";"Dicomere";"Dicomere Harina De Arroz Sin Tacc 1kg"
"Supermercado";"Otros alimentos";"Dicomere";"Dicomere Psyllium Husk Polvo 100g Sin Tacc Vegano"
"Supermercado";"Otros alimentos";"Dicomere";"Soja Texturizada Dicomere 350g"
"Supermercado";"Otros alimentos";"Dicomere";"Aji Molido Dicomere 50 Gr"
"Supermercado";"Otros alimentos";"Dicomere";"Provenzal Ajo Y Perejil Dicomere 50 Gr"
"Supermercado";"Otros alimentos";"Dicomere";"Pimentón Ahumado Dicomere 50g"
"Supermercado";"Almacén";"Dicomere";"Sal Marina Fina 450g - Dicomere - Sin Tacc - Libre De Gluten"
"Supermercado";"Otros alimentos";"Dicomere";"Ajo En Polvo Dicomere 50 G"
"Supermercado";"Otros alimentos";"Dicomere";"Harina De Coco Dicomere 200g"
"Supermercado";"Almacén";"Dicomere";"Cacao Amargo Puro En Polvo 200g Dicomere Sin Azucar Sin Tacc"
"Suplementos";"Vitaminas y Salud";"Vitamin Way";"Vitaminway Ginkgo 120 Complex Atención Concentración Memoria Sabor No"
"Suplementos";"Vitaminas y Salud";"Vitamin Way";"Vitaminway Colágeno Facial 30 Cápsulas"
"Suplementos";"Otros";"Vitamin Way";"Vitaminway Clorofila Cleanse 30 Capsulas"
"Suplementos";"Quemadores";"Vitamin Way";"Vitamin Way Spirulina Adelgazante Control Del Peso"
"Suplementos";"Otros";"Saint Gottard";"Infusión Saint Gottard Frutos Del Bosque X 20 Saquitos"
"Supermercado";"Otros alimentos";"Every Day Nature";"Sulfato De Magnesio Sales De Epsom Every Day Nature 1kg 100% Pureza Edn Nutrition"
"Supermercado";"Snacks";"Wik Taste";"Barra De Cereal Wik Taste Sin Tacc Sabor Quinoa/chocolate 20 g De 20 u"
"Suplementos";"Pre-entrenos";"Star Nutrition";"Pre Entrenamiento Pump 3d Ripped 315g Star Nutrition Pre Work Sabor Strawberry Lime Vaso Legend 600ml"
"Supermercado";"Almacén";"Hgl-Organikal";"Te Verde Matcha Manzana Y Canela Organikal Vegano Sin Tacc"
"Supermercado";"Almacén";"Hgl-Organikal";"Te Verde Matcha De Vainilla Bourbon Hg Organikal Superfoods 50g"
"Suplementos";"Vitaminas y Salud";"Gold Nutrition";"Vitaminas K2 + D3 Vegetal Gold Nutrition Comprimidos X 30 Sabor Neutro"
"Suplementos";"Quemadores";"Gold Nutrition";"Quemador De Grasa Lipo Gold Elite 60 Caps Gold Nutrition Sabor Sin Sabor"
"Hogar";"Otros hogar";"RV Home";"Inodoro Baño Bidet Inteligente Rv Home Smart Temperatura 107"
"Hogar";"Otros hogar";"RV Home";"Inodoro Baño Bidet Inteligente Rv Home Y6 Smart Temperatura"
"Hogar";"Otros hogar";"RV Home";"Pileta Bacha Cocina Premium Smart Rv Home Acero 304 Full"
"Hogar";"Otros hogar";"RV Home";"Pileta Bacha Cocina Smart Premium Acero 304 Rv Home"
"Hogar";"Otros hogar";"RV Home";"Pileta Cocina Bacha Nanotecnologia Rv Home Color Negro 3.5mm"
"Suplementos";"Combos";"Star Nutrition";"Combo Star Nutrition Suplemento En Polvo Creatina 100% Pura 300g x2 unidades"
"Suplementos";"Vitaminas y Salud";"Garden House";"Garden House Doble Omega 3 Colesterol X 60 Caps"
"Hogar";"Otros hogar";"RV Home";"Pileta Cocina Bacha Tradicional Rv Home Color Negro"
"Suplementos";"Vitaminas y Salud";"Breaking Lab";"Percarbonato De Sodio Puro - 1 Kg Limpiador En Polvo"
"Suplementos";"Pre-entrenos";"Star Nutrition";"Pump 3d Ripped 315 Gr Star Nutrition Pre Entreno + Quemador Sabor Lemonade"
"Supermercado";"Otros alimentos";"Every Day Nature";"Whey Protein Real Whey Neix Reload 1 Kg Proteina Concentrada"
"Suplementos";"Combos";"Hoch Sport";"Combo Hoch Sport x3 Testo High Boost Natural Testosterone 120 caps Sin Sabor"
"Suplementos";"Combos";"Hoch Sport";"Combo Hoch Sport x2 Testo High Hoch Sport Boost Natural Testosterone Premium 120 Cápsulas Sabor Sin Sabor"
"Suplementos";"Proteinas";"Ena";"Suplemento En Polvo Ena Sport Truemade Whey Protein Banana 930gr Vaso Legend 600ml"
"Suplementos";"Combos";"Star Nutrition";"Combo Star Nutrition Creatina Monohidratada Doypack 300g X3 + Vaso Legend Nutrition 600ml"
"Suplementos";"Vitaminas y Salud";"Vitamin Way";"Multi Magnesio 30 Capsulas Vitamin Way Sabor Neutro"
"Suplementos";"Vitaminas y Salud";"Vitamin Way";"Vitamin Way Magnesio Stress Tilo + L-teanina+vitaminas 30c Sabor Sin Sabor"
"Suplementos";"Vitaminas y Salud";"Vitamin Way";"Magnesio Quelato 30 Capsulas Vitamin Way Sabor Neutro"
"Suplementos";"Vitaminas y Salud";"Vitamin Way";"Vitamin Way Ginseng Guaraná Incrementa Energía Y Vitalidad Sabor Ginseng Rojo Coreano"
"Supermercado";"Otros alimentos";"Every Day Nature";"Suplemento Every Day Nature Citrato De Magnesio 1kg Vaso Legend 600ml"
"Suplementos";"Vitaminas y Salud";"Vitamin Way";"Suplemento En Capsulas Curcuma Jengibre 30caps Vitamin Way"
"Suplementos";"Vitaminas y Salud";"Vitamin Way";"Colágeno Mas Hialuronico Vitamin Way X 30 Caps Sabor Neutro"
"Suplementos";"Vitaminas y Salud";"Vitamin Way";"Colageno + Calcio Vitamin Way - 30 Capsulas"
"Suplementos";"Vitaminas y Salud";"Vitamin Way";"Complejo Vitaminico Cabello, Piel Y Uñas X30 Capsulas Sabor Neutro"
"Supermercado";"Almacén";"Oleovares";"Salsa De Soja X500 Ml - Oleovares Del Sol"
"Supermercado";"Otros alimentos";"Every Day Nature";"Suplemento En Polvo Every Day Nature Vitamina C Sabor Cítrico De 1kg Vaso Legend 600ml"
"Suplementos";"Proteinas";"Star Nutrition";"Suplemento En Polvo Star Nutrition Whey Protein 3kg + Vaso Legend Nutrition 600ml"
"Suplementos";"Creatinas";"Gold Nutrition";"Suplementos En Polvo Gold Nutrition Creatina Monohidratada 300g Vaso Legend 600ml"
"Suplementos";"Creatinas";"Star Nutrition";"Suplemento En Polvo Star Nutrition Creatina 100% 150g Pote"
"Suplementos";"Proteinas";"Hoch Sport";"Suplemento En Polvo Hoch Sport Whey Protein 2kg Sachet Polvo"
"Supermercado";"Otros alimentos";"Crudda";"Crudda Bar Caja Barrita Sabor Peanut Caramel Sin Tacc Vegan 10u"
"Suplementos";"Proteinas";"Hoch Sport";"Whey Protein 3 Kg Hoch Sport"
"Suplementos";"BCAA-Aminos";"Hoch Sport";"Arginine 1500 Hoch Sport 60 Capsulas Arginina Sin Sabor"
"Supermercado";"Otros alimentos";"Crudda";"Crudda Bar Caja Barrita Arandanos Y Nuez Sin Tacc Vegan 10un"
"Supermercado";"Otros alimentos";"Every Day Nature";"Suplemento Every Day Nature 2 Vitaminas C Sabor Cítrico De 1kg Polvo"
"Supermercado";"Almacén";"Oleovares";"Aceite De Oliva Extra Virgen X 500ml Pet - Oleovares Del Sol"
"Supermercado";"Otros alimentos";"Crudda";"Crudda Bar Caja Barrita Sabor Brownie Sin Tacc Vegan 10uni"
"Supermercado";"Almacén";"Oleovares";"Aceite De Girasol Y Aceite De Oliva Extra Virgen Oleovares Del Sol 500ml"
"Supermercado";"Almacén";"Oiiloleo";"Aceite De Oliva Extra Virgen En Frasco X 500 Ml Pet - Oiiloleo"
"Suplementos";"Creatinas";"Star Nutrition";"Suplemento Star Nutrition Ultramicronized Creatine Monohydrate De 500g - Polvo"
"Suplementos";"Otros";"Gold Nutrition";"Suplemento En Polvo Gold Nutrition 2lb + Vaso Legend Nutrition 600ml"
"Supermercado";"Almacén";"Oleovares";"Aceite De Oliva Extra Virgen Bidon X 2 Lt- Oleovares Del Sol"
"Suplementos";"Vitaminas y Salud";"Ena";"Suplemento Enacción Enaccion Colágeno Complex Sabor Limonada De 270g 2 Packs - Polvo"
"Suplementos";"Combos";"Vitamin Way";"Pack X3 Vitamina C Vitamin Way X 30cap"
"Suplementos";"Proteinas";"Ena";"Suplemento En Polvo Ena Sport Truemade Whey Protein Vainilla 930gr Vaso Legend 600ml"
"Suplementos";"Proteinas";"Ena";"Suplemento En Polvo Ena Sport Truemade Whey Protein Chocolate 930gr Vaso Legend 600ml"
"Suplementos";"Proteinas";"Ena";"100% Whey 2 Lb - Whey Protein Proteina Ena Chocolate Vaso Legend 600ml"
"Suplementos";"Ganadores de peso";"Star Nutrition";"Mutantmass 1,5kg Star Ganador Masa Frutilla Vaso Legend 600"
"Suplementos";"Proteinas";"Ena";"100% Whey 2 Lb - Whey Protein Proteina Ena Sabor Vainilla"
"Suplementos";"Proteinas";"Ena";"Whey Protein 900g Pura 80% Pack Ena Sabor Frutilla 900g"
"Suplementos";"Proteinas";"Ena";"Ena 100% Whey Protein. Proteina Concentrada"
"Suplementos";"Proteinas";"Gold Nutrition";"Vegetal Protein Isolate 2lbs 100% B12 Gold Nutrition Vegan Sabor Neutro"
"Suplementos";"Vitaminas y Salud";"Vitamin Way";"Vitamin Way Colágeno Bebible Articulaciones 360gr Limon X2"
"Suplementos";"Combos";"Vitamin Way";"Vitamin Way Citrato De Magnesio Vitamina D 30 Caps Pack X3"
"Suplementos";"Vitaminas y Salud";"Vitamin Way";"2 Colageno + Calcio Vitamin Way - 60 Capsulas"
"Suplementos";"Vitaminas y Salud";"Vitamin Way";"3 Magnesio X 60 Caps Vitamin Way Sabor Neutro"
"Suplementos";"Vitaminas y Salud";"Vitamin Way";"4 Colageno + Calcio Vitamin Way - 60 Capsulas"
"Suplementos";"Vitaminas y Salud";"Vitamin Way";"3 Colageno + Calcio Vitamin Way - 60 Capsulas"
"Suplementos";"Vitaminas y Salud";"Vitamin Way";"Vitamina D X 30 Capsulas Vitamin Way"
"Suplementos";"Vitaminas y Salud";"Vitamin Way";"Vitamin Way Vitamina C Con Zinc X 30 Capsulas"
"Suplementos";"Vitaminas y Salud";"Vitamin Way";"Vitamin Way Up For Men Aumenta Vigor Y Potencia Masculina Sabor No"
"Suplementos";"Vitaminas y Salud";"Vitamin Way";"Vitamin Way Multivitamínico Y Multimineral Bienestar General"
"Suplementos";"Vitaminas y Salud";"Vitamin Way";"Suplemento Magnesio X 60 Caps Vitamin Way Sabor Neutro"
"Suplementos";"Vitaminas y Salud";"Vitamin Way";"Vitamin Way Magnesio + Calcio Con Vitamina C Y D 60 Cápsulas"
"Suplementos";"Vitaminas y Salud";"Vitamin Way";"K2 + Magnesio + D3 + Colageno Ii Vitamin Way X 30 Sabor Sin Sabor"
"Suplementos";"Otros";"Saint Gottard";"Te Saint Gottard De Menta 30 G Con 20 Saquitos"
"Suplementos";"Vitaminas y Salud";"Vitamin Way";"Hair Repair Max Vitamin Way X 30 Capsulas Sabor Sin Sabor"
"Suplementos";"Vitaminas y Salud";"Vitamin Way";"Colageno + Calcio Vitamin Way - 60 Capsulas"
"Suplementos";"Otros";"Saint Gottard";"Té Saint Gottard Rojo Con Vainilla X 20 Saquitos"
"Suplementos";"Otros";"Saint Gottard";"Infusion Saint Gottard Delicia De Dulce De Leche X 20 Saq"
"Suplementos";"Otros";"Saint Gottard";"Té Saint Gottard Rooibos Sabor Avellana Caramelizada"
"Suplementos";"Otros";"Saint Gottard";"Infusión Saint Gottard Grosella, Mora Y Arándanos X 20 Saq"
"Suplementos";"Otros";"Saint Gottard";"Tisana Laxante En Saquitos X 20 Unidades. Saint Gottard"
"Suplementos";"Otros";"Saint Gottard";"Te Saint Gottard Verde Con Menta, Sabor Miel X 20 Saquitos"
"Suplementos";"Otros";"Saint Gottard";"Infusion Saint Gottard Chocolate A La Menta X 20 Saquitos"
"Suplementos";"Otros";"Saint Gottard";"Infusión Saint Gottard Surtido Frutal 5 Variedades X 20 Saq"
"Suplementos";"Otros";"Saint Gottard";"Té Saint Gottard Arándano Y Frambuesa"
"Suplementos";"Otros";"Saint Gottard";"Infusión Saint Gottard Limón, Lima, Jengibr Y Menta X 20saq"
"Suplementos";"Vitaminas y Salud";"Saint Gottard";"Té Saint Gottard Citrus Mix, Jengibre Y Sabor Miel"
"Suplementos";"Otros";"Saint Gottard";"Matcha En Saquitos Con Menta Y Limon"
"Suplementos";"Quemadores";"Saint Gottard";"Tisana Detox Saint Gottard 20 Unidades"
"Suplementos";"Vitaminas y Salud";"Vitamin Way";"Vitamin Way Colágeno Bebible Articulaciones X 360gr Sabor Cítrico"
"Suplementos";"Vitaminas y Salud";"Vitamin Way";"Colageno Beauty+flex Vitamin Way 360g Sabor Limón"
"Suplementos";"Vitaminas y Salud";"Vitamin Way";"Citrato De Magnesio En Polvo 180g Vitamin Way Con Vita C Y D Sabor Limón"
"Suplementos";"Vitaminas y Salud";"Vitamin Way";"Vitamin Way Citrato De Magnesio Vitamina D 30 Cápsulas Sabor Sin Sabor"
"Suplementos";"Vitaminas y Salud";"Star Nutrition";"Vitamina C 60 Cápsulas - Star Nutrition Sabor Sin Sabor"
"Suplementos";"Creatinas";"Protein Project";"Creatine Monohydrate X 200grs Sin Sabor - Protein Project"
"Suplementos";"Proteinas";"Star Nutrition";"Collagen Whey Protein 2 Lb (prote+ Colageno)- Star Nutrition Sabor Vainilla"
"Suplementos";"Proteinas";"Star Nutrition";"Collagen Whey Protein 2 Lb (prote+ Colageno)- Star Nutrition Sabor Chocolate"
"Supermercado";"Snacks";"integra";"Granola Almendra Y Arandanos X 350g Integra"
"Supermercado";"Snacks";"integra";"Granola Almendra Y Chocolate X 350g Integra"
"Supermercado";"Snacks";"integra";"Granola Chocolate Integra 1 Kg"
"Supermercado";"Snacks";"integra";"Granola Almendras Y Arandanos Integra 1kg"
"Supermercado";"Snacks";"integra";"Bocaditos Integra Mix Mani Choco Arandanos Choco 20u X 26g"
"Supermercado";"Snacks";"Integra";"Bocadito De Cereal Integra Chocolate Mani Pack 20u"
"Supermercado";"Snacks";"Integra";"Bocaditos Integra De Chocolate Con Arandanos 20u X 26g"
"Bodega";"Bodega";"Neix";"Creatina Monohidrato Micronizada 1 Kg Neix Pura Nutricion Vaso Legend 600 Ml"
"Suplementos";"Vitaminas y Salud";"Gold Nutrition";"Colageno Hydrolizado Age Biologique Ac Hi Q10 Vitc 60caps X3 Sabor Sin Sabor"
"Supermercado";"Cuidado personal";"SriSri";"Pasta Dental Sri Sri Sudanta Vegano Libre Fluor 100g Pack X3"
"Supermercado";"Cuidado personal";"SriSri";"Pasta Dental Sri Sri Sudanta Vegan Libre De Fluor 100g"
"Suplementos";"Combos";"Star Nutrition";"Combo Star Nutrition Whey Protein Proteínas De 908g Pack X2 + Vaso Legend 600 Ml"
"Suplementos";"Combos";"Leguilab";"Stress Killer 60 Capsulas Magnesio Bisglicinato L-teanina Pack X2"
"Suplementos";"Proteinas";"Natural Whey";"Suplemento En Polvo Citrato De Magnesio 1kg Natural Whey Vaso Legend 600ml"
"Suplementos";"Combos";"Breaking Lab";"Suplemento Antioxidante Breaking Lab Vitamina C Pura 100% 60 Capsulas Pack X3"
"Suplementos";"Combos";"Breaking Lab";"Breaking Lab Curcuma + Pimienta Negra + Vitamina C X 50 Capsulas Pack X2"
"Suplementos";"Combos";"Breaking Lab";"Breaking Lab Curcuma + Pimienta Negra + Vitamina C X 50 Capsulas Pack X3"
"Suplementos";"Proteinas";"Mervick";"Suplemento En Barra Mervicklab Whey Protein Bar Low Carb Sabor Choco Coffee En Caja De 552g 12 Un"
"Suplementos";"Proteinas";"Mervick";"Suplemento En Barra Mervicklab Whey Protein Bar Low Carb Sabor Frutos Rojos En Caja De 552g 12 Un"
"Suplementos";"Proteinas";"Natural Whey";"Suplemento Natural Whey Glicinato De Magnesio 60 Cápsulas"
"Suplementos";"Proteinas";"Gold Nutrition";"Whey Protein 100% Gold Nutrition Suplemento en Polvo Doypack 2LB"
"Suplementos";"BCAA-Aminos";"Nutrex Research";"Bcaa 6000 Nutrex - Aminoacidos Ramificados - 30 Servicios - Sabor Fruit Punch"
"Supermercado";"Otros alimentos";"Ataca";"Funko Pop! Star Wars Luke Skywalker & Grogu #583"
"Supermercado";"Otros alimentos";"Ataca";"Funko Pop! Ahsoka Tano 650 Star Wars"
"Supermercado";"Otros alimentos";"Ataca";"Figura De Acción Superman Justice League 13704 De Funko Pop! Heroes"
"Supermercado";"Otros alimentos";"Ataca";"Figura Articulada Anime Heroes Naruto Orig Bandai 36901"
"Supermercado";"Otros alimentos";"Ataca";"Figura Bandai Naruto Uzumaki Final Battle Anime Héroes 17cms"
"Supermercado";"Otros alimentos";"Ataca";"Anime Figura Naruto Shippuden Uchiha Sasuke Int 36902 Wabro"
"Supermercado";"Otros alimentos";"Ataca";"Bandai Anime Heroes - Naruto Shippuden Jiraiya 15cm Playking"
"Supermercado";"Otros alimentos";"Ataca";"Figura Piccolo Dragon Stars Dragon Ball Z 40721"
"Supermercado";"Otros alimentos";"Ataca";"Dragon Ball Original Super Saiyan 2 Gohan Serie 11 - 36186"
"Supermercado";"Otros alimentos";"Ataca";"Vegeta Dragon Ball Super Hero Dragon Stars Figura Bandai"
"Supermercado";"Otros alimentos";"Ataca";"Banpresto Figura Match Makers Goku Kaioken Vs Vegeta 88041"
"Supermercado";"Otros alimentos";"Ataca";"Figura De Dragon Ball Z - Super Saiyan Son Goku - Caja De Historia"
"Supermercado";"Otros alimentos";"Ataca";"Banpresto Dragon Ball Z History Box V10 Gohan Super Saiyan 2"
"Supermercado";"Otros alimentos";"Ataca";"Banpresto Figura One Piece Monkey D Luffy Gear 5 Cranenking"
"Supermercado";"Otros alimentos";"Ataca";"Anime Heroes Naruto Uzumaki Figura Articulada 6.5 Bandai"
"Supermercado";"Otros alimentos";"Ataca";"Naruto Muñeco Figura Uchiha Itachi 36904"
"Supermercado";"Otros alimentos";"Ataca";"Figura Banpresto One Piece Monkey D Luffy King Of Artist"
"Supermercado";"Otros alimentos";"Ataca";"Naruto Shippuden Sasuke Uchiha Curse Mark Bandai Replay"
"Suplementos";"Proteinas";"Natural Whey";"Ashwagandha Mora Mayor Pura 100 Gramos Natural Whey"
"Bodega";"Bodega";"Neix";"Suplemento En Polvo Creatina Monohidrato Micronizada Pura 1 Kg Neix Reloaded"
"Supermercado";"Cuidado personal";"SriSri";"Pasta Dental Gel Sri Sri Sudanta 200g Y 2 Cepillos C/dura"
"Supermercado";"Otros alimentos";"SriSri";"Sahumerios De La India Stick Sri Sri Ayurvedico Santalum"
"Supermercado";"Cuidado personal";"SriSri";"Sahumerios Sri Sri Ayurvedico Tattva Incienso Mirra"
"Suplementos";"BCAA-Aminos";"Nutrilab";"Suplemento Nutrilab Bcaa Recovery Aminoácidos 300 Grs"
"Suplementos";"Proteinas";"Nutrex Research";"Nutrex Muscle Infusion Blend Aislada Hidrolizada X 2 Lb Sabor Vainilla"
"Suplementos";"Proteinas";"Nutrex Research";"Nutrex Muscle Infusion Blend Aislada Hidrolizada X 2 Lb Sabor Chocolate"
"Suplementos";"Quemadores";"Nutrex Research";"Lipo 6 Black Hers Quemador De Grasa Mujer Nutrex 60 Capsulas"
"Suplementos";"Creatinas";"Nutrex Research";"Creatina Drive 300g. Nutrex"
"Supermercado";"Snacks";"Integra";"Barritas Integra Proteica Pasta De Mani Y Arandanos X10u"
"Supermercado";"Snacks";"Integra";"Barritas Integra Proteica Mani Y Colchon De Chocolate X10u"
"Suplementos";"Quemadores";"Nucleo Fit";"Suplemento Lipo Training Nucleo Fit Pote De 60 Comprimidos"
"Suplementos";"Creatinas";"Nucleo Fit";"Suplementos En Polvo Creatina Nucleo Fit En Pote De 300gr"
